,tweet,bert_predict,lstm_predict,bert_lstm_predict
4061,dpt chat malam sahabat sekeluarganya covidad neneknya yg ngerawat dari bayi skrg covidtrs nunggu obat hari krn kosongya allah plis atuh pak penyalurannya dicek beli obat covid apotek mahal bener pak katanya,1,-1,-1
4062,boro boro bantu biaya hidup rakyat saat ppkm darurat eh si ono jualan vaksin trus lu bilang die merakyat,-1,-1,-1
4063,nyokap hade ya lanhalan ainx hayula bandung besok naik bus murah sampe kita sewa motor nyokap halaa masi covid kudu tes rapid kudu begitu hehe doi ngatau bulan ainx diem diem bandung sendirian,1,1,1
4064,ppkm darurat rencana diperpanjang ppkm darurat hari kesekian belom dampak positif signifikan agenda vaksin belom jelas kegunaanya disuruh bayar harga sembako mulai naik kurang suplai nasib pejuang rupiah golongan bawah gimana ya,-1,-1,-1
4065,knp sih suka membayangkan yg tjd contohnya seandainya pnya anak bs hemat biaya segini seandainya pnya anak boros biaya segini ini yg sampe apalseandainya km keluarga kena covid seandainya yg meninggal kena covid jd covidiot santai napa,-1,-1,-1
4066,btw aku cek covid rs tarakan alhamdulillah biaya ronsen cek darah obat obatan segambreng gratis lega sih secara waktu konsul di rs swasta obatnya juta tapi berobat rs pemerintah rujukan covid sabar antre,1,1,1
4067,btw vaksin anjing mahal drpda vaksin manusia ya,-1,-1,-1
4068,cukup bingung sudah berbayarvaksin nama yang sama sudah berjalan titik nya sebar yang bayar di tolak ramai ramai yang bayar perusahaanaja yang antri,-1,-1,-1
4069,kalo diitung biaya vaksin lengkap bocil sampe ntar th buat beli motor ya,1,1,1
4070,btw mcd katanya kena satgas covid bayar denda masa,-1,-1,-1
4071,abis liburan tiba tiba kepala puyeng ubun ubun bendenyut mata merah ama panas demam panik itu tentu covid barangkali duitmu habis kamu lupa bayar angsuran bri bon bonan warung tonggo,-1,-1,-1
4072,vaksin gratis untuk umum gak ah ga berani dah vaksin tetep aja bisa kena giliran vaksin dah berbayar negara ini penuh konspirasi vaksin aja bayar gini nih pemikiran orng percaya klo naruto sakura masuk akatsuki dasar penduduk negeri wano,-1,-1,-1
4073,anggaran penanggulangan covid kalo ada sisa itu sdh cukup utk biaya lockdown hari biar penanggulangannya efektif,1,-1,1
4074,ayo vaksin herd immunity dibikin vaksin gratis ngantri aduh ngantri lama banget giliran gw dibuat vaksin bayar bisa ngantri gratis negara berbisnis rakyat dasar kiri kanan belakang negeri bercanda,1,1,-1
4075,swab bayar vaksin bayar lockdown ga berani netflix bayar,-1,-1,-1
4076,kalo covid nggak bikin kelen takut ingatlah kalo positif perlu cepat dapet kamar biaya rs njebluk dompetmu kempes sekempeskempesnya pengalaman pribadi mengajarkanku ini duit thr melayang tabungan terobokobok youre welcome,-1,1,-1
4077,vaksin bayar gapapa yg penting vaksin gratis tersedia seluruh rakyat indonesia mendapatkan vaksin secara gratis,1,1,1
4078,layanan homecare covid emang penolong lg kondisi ya jatuhnya emang mahal tp lebh baik mendatangkan dokter yg swab jg layanan obat jg konsul kerumah drpd rs yg kepastian kasus adik skrang ketolong layanan homecare smg kondisinya stabil ga memburuk,1,-1,1
4079,lha pada ngomporin percaya covid akibatnya covid meluas wajar orang indonesia haji nah ga boleh haji meremere berkata pedas cabai mahal,-1,-1,-1
4080,kondisi pandemi serba batasi dikurangi guna menekan laju virus covid sebagai rakyat wajib mentaatinya pandemi berakhir nmun kondisi pandemi satu tidak di batasi di kurangi bayar ukt hahay,-1,-1,-1
4081,juta mau test plus vaksin kepikir ga biaya yg keluarin udah udah korup berita terpapar yg mati ga berhenti terus beritain perkara senyap ditelan berita covid sdh lelah mendengar berita covid berujung,-1,-1,-1
4082,vaksin gratis dibilang bahayavaksin bayar dibilang membisniskan gak sih orang tolol kayak gitu dideportasi aja buang kek kemana,-1,-1,-1
4083,orang ribut kimia farma buka klinik vaksin kalo lu ga bayar ikut yg gratis juga yg bayar vaksin disana berarti ya duit bayar masalah nya yg salah lu ributin kimia farma lu ga divaksin,-1,-1,-1
4084,yah orang yg takut kena covid trus uda dapet giliran vaksin pas dipanggil ga nongol beribu juta alasan diluar yg antri biar dapet giliran sampe bayar demi dapet jatah vaksin banyakheran mahluk kaya gini,-1,-1,-1
4085,kejadian yg terjadi lab kimia farma pd bandara kualanamu tsb sungguh menimbulkan efek buruk kepercayaan masy atas pelaksanaan test covid sbb kejadian dilakukan oknum petugas perusahaan farmasi bumn kan gk gratis mahal lg,-1,1,-1
4086,mahalnya ubat kutu kucing vaksin murah dri ubat kutu,-1,1,-1
4087,vaksin dikasi tanda teknologinya blm yg namanya benda padat dimasukkan dlm benda cair harganya mahal tugas kepentingannya blm sinkron,-1,-1,-1
4088,tadi lemes abis vaksin liat preview bsts langsung seger murah ya wkwkwk,1,-1,1
4089,statement org yg pendapat ya vaksin yg dijual pilihan aja kalo cepet ga ngantri ya bayar kan yg gratis ga daa otakk,-1,1,-1
4090,bingung deh takut corona masih belom bayar motor uas utang utang yang belom kebayar gundah gulana,-1,-1,-1
4091,vaksin percaya ko bayar esok bayar balik percaya,1,-1,1
4092,gue seneng banyak yg aware sm covid warung deket rmh gue udh pasang plastik pembatas penjual sm pembeli kalo bayar uangnya taro etalase aja katanya biar ga sentuhan penjualnya jg rajin pake masker mh engga gue seneng sksk,1,-1,1
4093,tdk banyak komentar soal ricuh vaksin gotong royong sdh dibilang diwarning dr kmrn ditweet sinopharm mahal efikasi rendah ga bagus dr sinovac tp mahal vaksin hrsnya gratis mending dananya sponsorin bantu eijkman unair mending diplomasi utk dpt vaksin sputnik,1,1,-1
4094,corona skrng jahat bgtt pas awal awal sasarannya tuh masker mahal skrng oksigen susah cari korban yg butuh donor darah susu skrng jdi lumayan mahal,-1,-1,-1
4095,utang besar china memberikan tawaran paling merugikan indonesia wabah covid yg berasal china sulit indonesia untuk bangkit ekonomi bayar utang,-1,-1,-1
4096,hari vaksin una mager bgt rasanya rs ditambah kudu ngeluarin uang jutaan wkwk mahal bgtsi vaksin tp gpp anakku sehat,-1,1,-1
4097,bedanya vaksin gratis vaksin bayar,1,1,1
4098,ngomongngomong soal vaksin nih vaksin anak yg gratis pake bpjs faskes yg menyediakan yg bayar gitu jenisnya beda gimana,-1,1,-1
4099,ntar logika gue gak nyampe kayanya gini vaksin gratis aja gak ini wacana vaksin berbayar apa membantu nakes katanya bayar tuh utang lu rsrs baru membantu nakes,-1,1,-1
4100,vaksin gratis vaksin bayar vaksin gratis kebijakan terlihat terkendali kebijakan lain hhm,1,1,1
4101,hadirnya corona sebagian besar jadikan ajang bisnis kerja batasi sweb merajalela bayar hadehh,-1,-1,-1
4102,gw sblm corona mah duit ngalir terus aja gitu pagi dikasih duit malem setiap minggu jg lu ga saldo busway gw yg tapin ga kuota gw kasih hotspot klo lu bilang pinjem dil ntr gw bayar yah gw tagih klo cuman bodoamat dah lebih anjirr,-1,-1,-1
4103,vaksinlah mumpung gratis ditunda bakal kebagian vaksin gajelas disuruh bayar,-1,1,-1
4104,soal vaksin ya kata guru ekonomi jaman smp sesuatu melibatkan bayar membayar ya namanya bisnis yg segini nya anak ipa bs mikir gimana sosialismenya menghadapi pandemi ya msh ada bisnis pancasilanya dimana anak ips kemana,-1,-1,1
4105,pertama corona musim nya masker mahal corona pakedua musimnya susu bear brand mahal paketiga nih,-1,-1,-1
4106,kubilang gak enak jd kelas menengah negara vaksin gratis nunggu antrian mau yg bayar nunggu gajian dipukul kirikanan hari jauh subsidi jauh kenyamanan menikmati gaji,-1,1,-1
4107,vaksin posyandu vaksinasi lengkap untuk anak gratis eh rame nyari yg berbayar berlomba mahal,-1,1,-1
4108,akhirnya semua di vaksin tinggal pilih yg gratis nanti bayar,1,1,1
4109,covid gw klo beli makanan rasa enak harga murah yg jualan pake masker,1,1,1
4110,gue heran deh pemerintah korea hebat bgt bayar suju bikin cf kampanye covid kek gini,1,-1,-1
4111,kalo vaksin bayar trs covid naik mampus dah lo,-1,-1,-1
4112,orangorang yg gak vaksin mending pake ventilator bayar obat ya dibanding demam sebentar karna dpt vaksin,-1,-1,-1
4113,gua jadi mikir gak sii ternyata rnx di bayar suatu perusahaan orang apalah untuk membuat isu covid gak dia berusaha gigih karna untuk mengalihkan isu lebih besar,-1,-1,-1
4114,kcg biaya pukeswan ragunan untuk vaksin berobat kira terjangkau ga sih menurut,-1,1,-1
4115,jokowie gak punya duit gmn membendung kalo rs rs belum bayar jokowie,-1,-1,-1
4116,pasien covid yg dirawat rs ditanggung kemenkes stlh pulang rawatkontrol puskesmas tdk kontrol rs krn bpjs tdk bayar klaim covid rawat jalanrawat inap gejala sedangberat kembali igd rs tdk swab pcr ulang pasien pulang ranapmandiri perlu,-1,-1,-1
4117,pemerintah sebaiknya mengabaikan politisi yg mempolitisasi vaksin berbayar yg bayar dia bayar rakyat mampu mau juga segera vaksin berbayar politisi jgn didengar politisi yg mirip psk ngaku perawan bikin riuh,-1,1,-1
4118,vaksin gotong royong bayar bener inikan penjelasan eka sila gotong royong pemerintah hebat penafsiran pancasilanya,1,-1,1
4119,janganjangan kota wuhan covid seluruh dunia strategi negara memiliki hutang ekonominya menjadi lemah perlahan pasti cina mencaplok asetaset penting dalamnya negara mampu bayar,-1,-1,-1
4120,orang tu klo dah benci ya berita baik tetep dianggep buruk vaksin gotong royong dari awalnya berbayar awalnya untuk korporat perusahaan gede bayar vaksinnya ke karyawan ga nagih,-1,-1,-1
4121,kaget banget pagi pagi liat biaya vaksin kimia farma,-1,-1,-1
4122,indo aja vaksin gratis pada ngga loh kabar kalo kayak thai disuruh bayar baht becanda banget ya tuhan,-1,1,-1
4123,usia tahun hasil negatif covid aja udah syukur anjing gausah mahal mahal mau negatif anjing,-1,-1,-1
4124,nemuin orang positif covid gampang bngt yak datang igd mau rapid antigen biaya karna habis panas hari yll keluar hasilnya ternya garis dua positif gk kyk juarang rapid antigen langsung positif,1,-1,1
4125,semalem baru ngomongin vaksin bayar beneran beritanya,-1,-1,1
4126,imunisasi bayi yg gratis posyandu yg bayar dokter vaksin covid yg gratis juga yg bayar tinggal pilih aja lu ribut anjing,-1,1,-1
4127,berjemur salah satu upaya meningkatkan kekebalan tubuh aktivitas hemat energi hemat biaya masih orang disiplin melakukanya ayoo mari sama berkontribusi mengurangi dampak covid,1,-1,1
4128,orang yg meremehkan protokol kesehatan himbauan pemerintah terpapar covid biaya ditangung dan ga usah nyalahin pemerintah,-1,1,-1
4129,vaksin gratis gamau suruh bayar komplain,-1,1,-1
4130,vaksin memiliki hak paten di perdagangkan di pasarkan menjadi solusi epidemi tebatas mahal apa bedanya kartel narkotika,-1,-1,-1
4131,pertama naik kereta lokal harga murah sebelum covid lenggang banget ga perlu berdiri,1,1,1
4132,takut bgt plis soalnya udah gue kasih fc ktp gue huhu gue kdu gimana takutnya gue ktemu pas vaksin gue gamau diurusin dia soalnya gamau bayar huhu,-1,-1,-1
4133,vaksin anak dokter swasta aja bayar pilihan kalo vaksin yg bikin tuh anak badannya ngga anget harganya tinggi sbg ortu jelas milih vaksin yg bikin badan si anak ngga angetlah cuma perkara vaksin berbayar untuk pencegahan covid aja ribut,-1,-1,-1
4134,dilihat yang terinfeksi corona sembuh terinfeksi kembali sama flu kita tidak enak badan kena flu makan obat warung sembuh kurang enak badan flu obat corona mestinya obat flu murah mudah dapatkan,-1,-1,-1
4135,bgt celah kesalahan pengadaan vaksin berbayar kaya aja si vaksin gratis langka aja pilihan murah trnyata vaksin bodong ketimpangan pelayanan citra buruk vaksin kaya yang gratis beneran vaksin ya atau,-1,1,-1
4136,anjir ini otak gw bercabang anjir kelanjutan bank sampah sidang sidang telat bayar spp usaha staup gw pada sakit corona ah asdfghjkl,-1,-1,-1
4137,bo dah satu tahun pandemi makin tajir yah maksudnya biaya klaim pasien covid hari rawatan mencapai juta hari pasien bisa kaya mendadak mah spesialisnya keles spp sppd,-1,1,-1
4138,kirain vaksin gotong rotong gratis ternyata bayar ya,-1,1,-1
4139,gw lg mikir klo misal korban jiwa krn lambe nya si misal ratusan sampe ribuan org ga mw vaksin ga mw pk masker ga mw gara abis nonton atw denger bacotnya si si mw tanggung jwb ga jaga ugdicu bayari biaya rs smp bayar pemakamannya dunia sdh gila,-1,-1,-1
4140,vaksin bayar gratis si,-1,1,1
4141,bulan biaya vaksin bulan tuhan cukupkan diberi amin,1,1,1
4142,di luar negeri vaksin bayar ga si,-1,-1,-1
4143,vaksin percaya pinjam nnti bayar percaya,-1,1,1
4144,ada covid ok gaji ok xde masalah hutang bole bayar jd mcmni terganggu mental pun terganggu penat malu tebalkan muka minta bantuan dr mak dr adik tp bila xusaha tp,-1,-1,-1
4145,ga percaya sih sm yg diceritain fajri kalo dsni org yg meninggal rumah sakit dibawa pulang jenazahnya bayar jtan kalo ga mau bayar dijaiin pasien covid jd org milih mending dijadiin pasien covid drpd suruh bayar ga percaya,-1,-1,-1
4146,kl pemerintah tegas menghukum pelanggar prokes provokator soal covid biaya wajib ditanggung pemerintah daerah dipastikan akan taat aturan para pemimpin daerah bekerja maksimal bergantung pusatketegasan kepastian hkm penting,1,1,1
4147,kira potongan harga corona bayar kampus ternyata,-1,-1,-1
4148,ndang rabi mumpung corona ian murah dengkulmu mlocot cuk,-1,1,-1
4149,alat skrining covid jenis mahal solusinya adl subsidi murah alat skrining murah tp kualitasnya kurang jadi guru besar susah soslusinya melonggarkan aturan yg bukan malah membuat aturan duplikat guru besar,-1,-1,-1
4150,denger bulan vaksin dah bayar gatau bener engga kuota vaksin ampe tgl besok aja udah penuh cok gila emang,-1,-1,-1
4151,vaksin dijual kimia farma rang orang males antri nunggu sepertinya gamau bayar vaksin gotong royong aja belom maksimal hadeh,-1,-1,-1
4152,jinos dipake krn murah lha murah kalung anti covid samasama alat screening,1,-1,1
4153,pak tlg kringanan biaya pnddikan orgtua siswa sman pwrjo msh hrs byr iuran bln slama masa pnddikan yg bsarnya lmyan berat disaat pndemi krn kami orgtua trkena dampak covid mtrnwun pak,-1,-1,1
4154,meninggal corona dapet juta juta untuk ahli waris juta biaya pemakaman untuk pihak rumah sakit teruskan pak monggo ne teruskan fantadziri ah fantadziri ah,-1,-1,1
4155,kata pak ustad klw berdoa yg baik hbd covid semoga panjang umur murah rezeky semakin betah,1,1,1
4156,arai ampe dijual murah buseh bener bener dah efek covid,1,1,1
4157,vaksin bayar buat mau bayar biar cepet ga ngantri,-1,-1,1
4158,vaksin bayar mending beli pop es,-1,1,-1
4159,gamau vaksin tuh ya padahal kita juga udah vaksin tinggal datang doang loh gratis nanti bayar misuhmisuh,-1,1,-1
4160,udah mulai seneng vaksin beli apd mulai gampang kadang mahal tau yang bermutasi,1,-1,-1
4161,jujurly jijay bgt pake kata ga tau vaksin sinopharm berbayarnyaa kf segmentasi pasarnya gimana yg rela bayar divaksin drpd ngantri para jelata mah pengennya pfizer ato moderna,-1,-1,-1
4162,vaksin bayar ngak asal vaksin gratis tersedia ada rumus diubah ya berani,-1,1,-1
4163,pengen vaksin bisa ga sih mksdnya rs gitu bayar gak,-1,-1,-1
4164,membuat dalam proses vaksin adm pencatatannya sistemnya ga pake kamera aja ya scan ktp langsung kebaca datanya transaksi marketplace pake cc ngajuin pinjol lebih cepat murah pengadaan nfc reader khusus misalnya,1,1,1
4165,vaksin ga pilihan bayar aja ya drpd rempong nyri ngantri eh trs ujung nya ga jg,-1,-1,-1
4166,klo kerja swasta jadwal vaksin covid berangkatlah vaksin perusahaan udah beli mahal vaksin covid kamu tinggal duduk manis aja ga bakalan loh,-1,-1,-1
4167,diskusi pagi rakyatnya dibatasi kewajiban negara gak ditunaikan pilihannya mati covid mati ga makan ga bayar utang ga ngutang dsb,-1,-1,-1
4168,katanya kalo ga vaksin denda jt eh taunya vaksin bayar rb potong gajih situ sibuk kasih jaket ama sepeda ajje vaksin kaga,-1,-1,-1
4169,rame soal vaksin bayar gratis ya se simpel yg ga dirumah aja ga punya rumah tidur dimana letakin badan diperhatikan bener aja udah senang apa klw memang mereka divaksin ditanya ktpnya,-1,1,-1
4170,selamat malam dunia lupa olahraga biar sehat penyakit tentang corona tapi aya kolesterol nyeri huntu dll sehat murah gering awis,1,1,-1
4171,beli vaksin negara menggunakan hasilnya untuk membina peralatan ketenteraan bagi merampas sebahagian zon ekonomi eksklusif berapa bayar untuk vaksin,-1,1,-1
4172,gangerti dah ama negara tes pcr aja mahal banget ye kek covid cuma nyerang konglomerat aje,-1,-1,-1
4173,oh vaksin gotong royong jutaanmahal uga yak wkwkwk,1,-1,1
4174,vaksin bayar hehehe,1,1,1
4175,vaksin harusnya jadi ikhtiar hidup mati nya yang perlu bayar goblog kontol sih anjing banget dipikir negara bangsat,-1,-1,-1
4176,kalo bener garagara covid jadi seat duduk dicut harganya naik gue bingung konser vlive yg juga toh gak seat duduknya harga ptj mahal jadi banget masalahnya kalo naikinnya jadi wokey lah,-1,-1,-1
4177,nyokap gua ngirimin vitamin suplemen yg harganya mahal banget menurut gua temen gua yg kena covid nyokap gua tau yg berjasa hidup gua temen semuanya mamah anggep anak mamah,1,-1,-1
4178,menyimak percakapan arumah sebelah takut divaksin terus teman atersebut menimpali dih vaksin aja mumpung gratis tinggal suntik lu sakit kopit tar keluar duit kalo ntarntar vaksin gratisnya abis lu ntar kudu bayar kalo mo vaksin kayak lu duit aja,-1,-1,-1
4179,oiya jirr gua menemukan kasus kecurangan sistem vaksin daerah gua masa biar dapet nomor antrian aja kudu bayar ceban asli indonesia kekurangan orang pinter kekurangan orang jujur,-1,-1,-1
4180,mincot kantor berhak bayar biaya perawatan karyawan terkena covid,-1,-1,-1
4181,kerja keras gue sampe tulang punggung rasanya retak perbulan cuman dihargai ribukarena covid resto bokap jadi susah tapi ternyata bayaran mahal tuhan berupa waktu gue habisin bareng bokap gue bokap pergi nemenin cuman gue,-1,-1,-1
4182,ngapain sih orangorang panic buying lu nyetok kaya juga kalo udah kena covid terus mati gak ngebawa lu surga kalo lu egois mikirin lu apalagi sampe dijual dengan harga mahal mikir,-1,-1,-1
4183,grab vaksin masal jadi naek yak biaya jalannya huft,-1,-1,-1
4184,udah kelar beres kamar masak bengkelin motor nyuci baju ganti sprei bersihin kamar mandi lapor spt ikut diklat frontliner vaksin pertama bayar netflix beli es batu ganti galon cuman kurang bok cintai,1,-1,-1
4185,liat org protes ppkm dgn alasan muak dikurung dipenjara bikin gabetah klo udh kena covid br berasa ternyata kesehatan segalanya saat sulitnya cr perawatan duit sembuh lebih mahal drpd uang makan sehari hari,-1,-1,-1
4186,hadeh hadeh kayak kata si ibuk nyari vaksin dah kayak nyari kerjaan lama pengen deh vaksin berbayar aja cukup kaia untuk membelinya yahh aku juga kaum keras kalo yg gratis ngapain bayar yee gak,-1,1,-1
4187,vaksin gratis berbayar aja ribut ditambah ributnya udah bayar vaksin nya sinopharm ribet benerr,-1,1,-1
4188,senang orang rela bayar untuk vaksin ujungujungnya ikut membantu lain terlindungi paparan covid dibilang biadab,-1,-1,-1
4189,seneng ya jadi mhs poltekkes dpt vaksin kopit duluan pen balik jadi mhs gamau bayar gasi,1,-1,1
4190,pagi papa telpon ngasih kabar duka koko disebelah toko papa jualan meninggal karna covid hari rabu ketemu papa kamis masuk rs subuh dia pergi sehat udah kerasa mahal,-1,-1,-1
4191,geh cek corona murah dmna ya,1,1,1
4192,waktu taun kmrn masker langka tp ttp ada yg jual dg harga murah tahun tabung oksigen tp ada tukang pengisian oksigen yg nolak oksigen untuk penjual ikan mndahulukan untuk yg kena covid dibumi sbnrnya ada orang baik ya langka,1,1,-1
4193,hal yg perlu dilakukan hentikan proyek infrastruktur yg urgen potong biaya untuk kegiatan koordinasi pemerintahan perjadin paket meeting narsum dsb alihkan penanganan covid kesehatan bansos,-1,1,1
4194,kasus maling vaksin sumut udah jadi bukti kalo dengan orang tuh koordinir orang mau bayar utk disuntik,-1,-1,-1
4195,seruju vaksin bayar jangan bumn biar kalo apa gak ruwet komplennya,-1,-1,1
4196,ya ninggal rumah penyakit komplikasi disuruh dimakamkan secara prokes covid bayar,-1,-1,-1
4197,cah menurut pengalamanku masyarakat susah dikendalikan upaya pencegahan penularan iku mergo sendiri punya kekhawatiran ngko lek covid trus isman gak entuk bantuan gak dapet pemasukan keluarga butuh makan sekolah juga tetep bayar cont,-1,-1,-1
4198,anjing banget sih vaksin bener kek bayar gitu bener anjing,-1,-1,-1
4199,syaratnya sertifikat vaksin pcr modyar susah mahal untuk pulang pak dirjen tolong dimutasi homebase,-1,-1,-1
4200,seminggu indonesia lockdown covid hilangbiaya ekonominya lebih murah dibandingkan cara yg,-1,1,-1
4201,td masjid indah banget trus bilang kesister jd pengen deh masjid yg diaceh lo buagus tiket kesana mahal gak yaa mending langsung mekkah dek corona iya,1,-1,1
4202,vaksin copy ori murah sikit,-1,1,1
4203,keadilan ternyata mahal ya si miskin dipenjara karena mampu untuk beli covid eh sikaya berhurahura keadilan,-1,-1,-1
4204,pak saya kritik bapak sebaiknya bapak mundur kerjaan bapak gak becus bohongnya ekonomi ancur corona gak abis abis swab test mahal gue gak ditangkap,-1,-1,-1
4205,iya indo tes covid aja menurut yg udh berpenghasilan tetap terbilang mahal pcr itu mahal bgt biaya gini yg bikin orang jg jadi mikir untuk sekedar tes doang tes tes gini jg ga sekali aja ya,-1,-1,-1
4206,nyatanya lebih takut biaya perobatan covid dibanding kena mikir pas klinik kalo positif gimana ya biayanya pastj bengkak ya gimana gaji aja sebulan kurang kebutuhan gaya hidup,-1,-1,-1
4207,awal corona sampe jilid pt tempat gua magang ga tuh tes masal lagi vaksin tindakan yg kerasa di rumahin di bayar wkwk ngirit bgt ya,-1,-1,1
4208,vaksin tuh bayak gk sih kampus nyuruh mahasiswa mau pkl vaksin gratis kalo diluar perintah kampus bayar gk masalahnya waktunya barengan kegiatan workshop dan gw jadi panitia disitu ejdofokw,-1,1,-1
4209,ppkm darurat meremehkan peranan vaksin prokes ingat ingat vaksin mahal prokes gak gratis,-1,1,-1
4210,kalo vaksin gratis ada yg bayar ya,-1,1,1
4211,bedanya vaksin yg gratis vaksin bayar bedanya,-1,1,1
4212,temen gw vaksin bayar vaksinasi mana dah emang yg bayar ya kalo mandiri,-1,-1,-1
4213,grgr corona doang ikyusan jd mahal bgt pdhl terakhir beli mothercare msh rebuan,-1,-1,-1
4214,sbbkan covid worldwide shortage barang pc mahal babi harga gpu semua skrg anjing menyesal buat awal,-1,-1,-1
4215,hadehh merepotkan corona berdasar kali langkah sweb ternyata lama jadi corona udah membiayai sweb seratus ribu kali jadi rbtolong sudahi corona bisa menjaga daripada di sweb bayar merepotkanenak jd dokter kmi yg repot,-1,-1,-1
4216,vaksin berbayar beneran kemudian hari mau vaksin bayar gitu,-1,-1,-1
4217,sbenernya dah pengen balik ke gym hati bimbang takut covid ngga sih ke takut dah terlanjur bayar rutin gak bisa datang krn waktunya bentrok terus hahahahaha,-1,-1,-1
4218,sehat mahal lg sakit jadi jgn jadi tolol ikuti prokes vaksinasi,-1,-1,-1
4219,sehat mahalyuk vaksin para lansia kita terbebas virus virus terutama virus covid selamat hari lansia,1,-1,1
4220,dikasih vaksin gratis vaksin disuruh bayar bilang pemerintah cari keuntungan masyarakat menderita mau anda hey,-1,1,-1
4221,ya allah dri td malem demam batuk sakit kepala sakit perut jg takut banget kena covid tes tp bayar,-1,-1,-1
4222,vaksin gratis jalan yg gratis masih yg gak vaksin lagi yg bayar gila,-1,1,-1
4223,vaksin mahal terbatas dibiayai negara pakek duit rakyat yang bangga masuk kelompok prioritas penerima vaksin ingat itu,-1,1,-1
4224,tenaga kesehatan meninggal upaya penanganan covid biaya pendidikan anakanaknya sarjana ditanggung para menteri kalau apa membedakan nilai perjuangannya awak kapal selam resiko tugas seragam kesatuan,-1,-1,-1
4225,mau vaksin kcg biaya dokternya dikali ya,-1,-1,-1
4226,semua orang mati dibilang corona skr krn bebas biaya rs melenyapkan sakit bawaan kanker ginjal diabetes jantung sakit aids mendadak ajaib sembuh,-1,-1,-1
4227,waktu covid mewabah indonesia pengusaha nyang menimbun masker masker jadi mahal para pengusaha menimbun tabung oksigen oksigen jadi mahal kenape bise karne hukum nyang kagak teges,-1,-1,-1
4228,pen langganan netflix deh gasih yg terpercaya gaberani bayar pake kredit debit bikin jenius ribet lg gabisa keluar strict parents udh covid mah yang jual netflix bukan akun curian orang anti tipu tipu gaa,-1,-1,1
4229,bulan gaji insentif covid nya bayar tahun aja pada gajian relawan covid di rsud cengkareng,1,1,1
4230,kopi menyentuh rb mahal nike warehouse diskon jt jadi rb harga corona murah,1,1,1
4231,jadi kcg temenku habis lahiran nawarin untuk adopt kittennya nunggu bulan masih bingung kira kira pengeluarannya gimana rencananya aku pingin vaksin steril terus untuk biaya makan pasir kira kira ya makasih,-1,-1,-1
4232,tunggu aja ada pahlawan bilang kalo vaksin ga jadi bayar,-1,-1,-1
4233,vaksin jual belikan bertujuan utk menyadarkan masyarakat membela negara utk bayar hu sebagian teks tersedia,-1,1,1
4234,suruh vaksin ga tapi ngedumel vaksin bayar lu tinggal dtng puskesmas bawa fotocopy ktp aja susah ntr giliran vaksin abis yg gratis bilang nye presiden ga tepat janji vaksin gratis lu kemana aja goblok bulan,-1,-1,-1
4235,belum vaksin yok vaksin yook segala urusan udh vaksin loh mumpung gratis ntar bayar jd susah,-1,1,1
4236,ada ye orang gak vaksin gua loh kalo ditawarin vaksin bayar gpp,-1,-1,-1
4237,vaksin untuk pandemi ternyata bayar aturannya membolehkan itu ya berarti aturannya salah gitu aja repot,-1,-1,-1
4238,emang covid penyakit mahal test test duit mulu,-1,-1,-1
4239,harga test corona murah jadi kayak diobral sampai ga tahu kalau teori ekonomi semakin permintaan harga naek isi tabung oksigen yang gratis yang sehat,1,1,1
4240,ayo bertahan hidup sampe covid hilang biaya pemakamannya mahal,-1,-1,-1
4241,vaksin percaya weyh pinjam duit sikitesok bayar percaya,-1,-1,1
4242,biaya bandung setelah covid antigen dll jadi,-1,1,-1
4243,dengar vaksin moderna yg hrgnya palong mahal dibanding yg laen bermasalah krn efek sampingnya berbahaya,-1,-1,-1
4244,jadi ceritanya mak gue mesen makanan nih lewat gofood bwat mam nnti sore rencana mau beli kfc yg bucket isi sksksk trus jdi kata bapa mahal soalnya trus kttnya udh makan mie ajangies bgt fak kta smwa sdh gx uwang covid jncu,-1,-1,-1
4245,orang tuaku kebagian vaksin udah disuruh bayar aja,-1,-1,1
