,tweet,bert_predict,lstm_predict,bert_lstm_predict
2568,ini cuman baca teori doang kalo ivig tuh bagus blablabla tp jd pilihan terapi terakhir soalnya mahal ga dipake rs ternyata skrng di pake covid vialnya jt sehari vial jt makannya lupa pake masker gais,-1,-1,-1
2569,ppkm minggu karyawan yg dirumahkan pkl shift malam pemasukan rp gagal bayar kontrakan gagal bayar cicilan gagal makan mati kelaparan diruang kontrakan dijemput ambulan dinyatakan kematian krn covid krn covid diphk gk beli makan mati kelaparan,-1,-1,-1
2570,temen papa kena covid bayar pake uang jt serem,-1,-1,-1
2571,halo kai mau melakukan refund tiket perjalanan saya positif covid prosedurnya gmn baik utk pembatalan lewat app dikenakan biaya ibu dtg langsung stasiun pembatalan karna positif covid datang langsung datang langsung dachlach,-1,-1,1
2572,masy yg dapet sepeda pakde pulangin dahh sepedanya pakde bayar vaksin ngurangin utang kasian pakde klo jadi kagetan,-1,-1,-1
2573,tetap percaya rezekimu gatau hidup dinegara sekarang swab pcr mahal takut vaksin bayar sekarang kartu vaksin berarti aku mau jadi golongan manusia bismillah lilahitaallah aja gpp saat ga terkesan realistis,1,-1,1
2574,jadi takut naik busway gara covid tinggi tp kalo bawa mobil bayar bensin parkir mahal uga ya bund duh syulit bener idup jaman pandemi,-1,-1,-1
2575,vaksin suruh bayar abis gini dungu bat pemerintah mongolia,-1,-1,-1
2576,orang disuruh mendekam dirumah garagara banyak kehilangan pekerjaan ga yg nalangin biaya hidup harian udah gitu vaksin disuruh bayar negara emang kalo butuh dukungan pemilu kitanya disuruh berantem pas butuh negara,-1,-1,-1
2577,harusnya sesederhana pemerintah bayar kf vaksin tetep gratis masyarakat kf dapet duit masyarakat dapet gratis sentra vaksin makin target vaksinasi pemerintah makin cepet,1,1,1
2578,teman fb nulis dindingnya dosa yg jahat kemanusiaan sedunia adlh dosa mbatnyuri dana bansos pandemi covid utk biaya pilkada serentak paham madam bansos,-1,1,-1
2579,swabtes gratis gak tau keluar hasilnya kalo tau cepet ya pake swabtes bayar vaksin gratis antrian panjang ada sampai masih ngantri dapat jadwal vaksin kalo cepet ya bayar dah paham uud,1,1,1
2580,asu gr gr covid kelapa ijo jadi mahal bat,-1,-1,-1
2581,lol vaksin tapi rakyat kena bayar untuk kos pentadbiran bila pengambilan vaksin tu menjadi swastakena bayar dapatkan rawatan difasiliti swasta,-1,-1,-1
2582,baca org yg pro vaksin kf berbayar ya karna di gaslight pemerintah barang langka dijual belikan pas udh mepet jadinya legowo yaudah gue bayar aja drpd antre kata juta org mampu yang antre vaksin gratis,-1,1,-1
2583,baru bbrp minggu gue ikut kampanyein ayo vaksin ayo vaksin eh vaksin disuruh bayar sekarang kampanye vaksin bakal dijawab emang lo bayarin,-1,-1,-1
2584,patungan rp bisa bantu biaya kesehatan yang membutuhkan termasuk biaya untuk penderita covid untuk penyakit kritis,-1,1,1
2585,dikasih vaksin gratis takut gilirian vaksin dibeli bilangnya mahal ko vaksin diperjual belikan hadeh,-1,1,-1
2586,corona coroni tai ajg kelaparan ga punya uang beli makan bisa bikin mati tai masih yg untungin susah berentinya kesehatan mahal harganya ya iyalah mahal makanye jadiin dagangan mane dibeli mulu tuh daganganye laris manis deh tuh tolol,-1,-1,-1
2587,argumen bilang apaapa vaksin bayar gratis masih mengabaikan risiko bisnis vaksin ditoleransi negara akuntabilitasnya remuk ini bisa jadi lampu hijau elit untuk bikin langkah yang lebih ekstrem,-1,1,-1
2588,sbnrnya ya kalo gamampu secara ekonomi mending gausah pelihara hewan krn pelihara bukan sekedar pelihara juga makhluk hidup drpd pelihara ujungnya gaada duit minta donasi ke rumah sakit kalo sakit vaksin biaya perawatan mending gausah,-1,-1,-1
2589,mberih corona ken beda tebke bel zewye antika bar bas ma ken ela mahal,-1,-1,-1
2590,kalo mempercepat vaksinasi ya kimia farma bikin aja gratisan ngapain jualan lucu alasannya mempercepat vaksinasi bayar,1,1,-1
2591,dikasih vaksin berbahaya besok vaksin bayar negara berbisnis rakyatnya gini nih kalo sekolahnya sampe pamit gak masuk kelas,-1,-1,-1
2592,biaya vaksin rb hmkorporat gede duluan berani dah,-1,-1,-1
2593,jakarta mau cepet vaksin dimana yah bayar gpp,-1,-1,1
2594,pcr mahal gimana lg yaa anjay emg corona,-1,-1,-1
2595,yang tau gak gimana caranya daftar vaksin covidbayar gpp deh,-1,-1,1
2596,heran test antigen ga cover bpjs engga pemerintah kasih harga murah test antigen misal puskesmas disni antigen paling murah rb orang yg punya gejala suspect covid mikir kali antigen klo gini mending uangnya makan,-1,1,-1
2597,corona paid promote anniversary tahun bertahan bayar dah akun gede,-1,-1,-1
2598,duit saman pakai mask guna untuk bayar vaksin,-1,-1,-1
2599,jujur aja hati menolak vaksinasi katanya gotong royong bayar di kimia farma target vaksinasi uda mencapai herd immunity gitu baru gaskan aja bayar yg pengen booster tarik duit aja gapapa,-1,-1,-1
2600,bapa gw random bet dah bapa gw kuliah jawa aja ya nggak ah nya bandung bandung biaya hidupnya mahal pabrik bapa lagi sepi garagara corona,-1,-1,-1
2601,kakean cangkem vaksin ngantri dowo takut pulang bawa covid vaksin yg bayarnegara berbisnis dg rakyat emang kntl,-1,-1,-1
2602,ya tuhan bangun pagi kudu cepet bayar won lanjut pergi nemenin kakek vaksin naujubilah rame sumpek lari sini pulang sore lanjut packing orderan baru selesai ditambah hetic po album nct dream aseq rasanyaa,-1,-1,1
2603,ponakan umur bulan kena covid menyusul adek nyokap batuk yallah bener takut dilevel sampe gak berani bayar parkir isi bensin ketemu orang gak kenal diajak ngobrol tetangga beli makanan diluar,-1,-1,-1
2604,obat covid mahal bgt cuk gue pikir rb strip taunya kaplet anjir,-1,-1,-1
2605,percaya vaksin percaya bayar minimum kad kredit tu takpe,1,-1,-1
2606,inti nya gue dapet duluan vaksin ada bayarin mandiri berarti vaksinisasi kacau ya nunggu waktu sih ancang perusahaan pengen bayar vaksin karyawan nya kayak nya vaksin mandiri berasa supply nya aja,-1,-1,-1
2607,pasien covid charge biaya rumah sakit sebesar jtmohon bantuan kemenkespasiennya baru meninggal,-1,-1,-1
2608,mau tes covid baik pilih tes pakai antigen deh pada genose harga tes antigen udah yang dibawah rb mungkin mahal pada genose terbayar keakuratannya balik ini demi kesehatan keluarga orang,1,1,1
2609,follow mbak mbak virgo ya sumpah orgnya itungan bgt biaya ongkir biaya pesen makanan biaya tf dll medit ya allah kalo doain org yg ga percaya covid sumpah jahat jahat tp paham,1,-1,-1
2610,vaksin udh bayar yang gratis bakal tetep apa gmana ya,-1,1,-1
2611,dah bayar shoppe shein tahu jampt tutup covid,-1,1,-1
2612,boro boro bayar vaksin waktu sd aja pas vaksin kabur,-1,-1,-1
2613,ojol ngenter orang sebuah tempat tiba lokasi ternyata ojol diberi tip ribu sontak ojol kaget heran dikasih tip gede banget ternyata usut punya usut si pelanggan positif corona udah gila dikira ribu cukup biaya isoman hari,-1,1,-1
2614,bingung org ngebela jokwowi segitunya emang diuntungkan ya kalo lu covid gabisa bayar cicilan emang dibantu xixixixixi,-1,-1,-1
2615,naif polos ya gue kira orang mampu aja bayar untuk vaksin biar bantu pemerintah wkwkwkwkwk ternyata ya ngga dong,-1,-1,-1
2616,lagilagi orang gue kenal berpulang covid harga sangat mahal untuk ditebus,-1,-1,-1
2617,ko ya test covid mahal mahal,-1,-1,-1
2618,kalo ga covid ga tuh nyoba ketempat mahal kalo ga diskon semua plus minus nya ya,-1,-1,-1
2619,jog sepupu positif covid sempet ketemu dia juni karena ultah ponakan mantau diriku gimana ya baiknya swab mahal soalnya lagi bokek,-1,-1,1
2620,temen awal pandemi jatah wfh dipake jalan udah diingetin berkali bilangnya gue bete kosan aman skrg sakit gejala corona disuruh swab bilangnya mahal takut dijauhin kalo positif mon maap susah simpati,-1,-1,-1
2621,vaksin bayar gaakan dipermasalahin klo sistem vaksin gratis udh maks bener wajar klo org protes krn experience divaksin gratis yg kurang ngenakin jdi mari fokus benahi sistem yg dibuat utk umum klo kimfar ngasih pelayanan yg oke sistem umum bisa,1,1,1
2622,orang kampung kenal vaksin kalo digratiskan mereka takut ini bayar,-1,-1,-1
2623,emak paham biaya sekolah anak smk bikin nguras tenaga fikiran suami semenjak corona kerjaannya ga,-1,-1,-1
2624,aslii dah covid lu tega bgt anak skolah swasta bayar mahal mahal kaga ngerasain fasilitasnya,-1,-1,-1
2625,kadruners sibuk teriak vaksin berbayar mahal tu ngerti harga vaksin mahal knp gak vaksin gratis lo di sediakan pemerintah,-1,1,-1
2626,yang percaya covid yang ga percaya kalo covidhmm kebenaran memang mahal,1,-1,-1
2627,ini zaman corona tetep bayar zakat ga masker,-1,-1,-1
2628,prinsip mama kalo vaksin bayar harus yg gratis ok ma,1,1,1
2629,cepetan vaksin mumpung gratis ntar disuruh bayar ngamookk,1,1,1
2630,gue sih awal udah gak yakin genose gak coba biar harganya murah kalo mo tes covid minimal antigen deh gak usah maen maen penyakit,-1,-1,-1
2631,vaksin berbayar asal ppijer mah siap bayar sih tbh terserah ngomong tapi kasta vaksin emang nyata,1,-1,1
2632,rakyat susah jualan vaksin bencana nasional drop vaksin semua faskes bayar gimana ya cara mikirnya,-1,-1,-1
2633,bayar jitu pengaruh omongan antivax gak percaya covid bhw adalah bisnis semata aneh aja dah,-1,-1,-1
2634,tahu arah gerak vaksin mana kurang minatnya vaksin gotong royong perusahaan setali vaksin gratis awal rencana perusahaan yang bayar kita bisa melawan sains virus gerak cepat vaksin pergerakan lambat,-1,1,-1
2635,beli kelapa ijo ko mahal yak pas buka socmed baru ngeh banyak peminatnya katanya nyembuhin covid gimana atuh woi relasinya,-1,-1,-1
2636,kasian orang kuliah kedokteran mahal pegel capek begadang kalah sabda emak emak minum kelapa corona ilang,-1,-1,-1
2637,kayaknya cenayang deh janji biaya sekolah gratis ternyata bener sekarang gratis ga sekolah covid,1,1,-1
2638,vaksin siap dibagi gtdia bilang gratis gak masa rakyat bayar,1,1,-1
2639,lek covid gak percoyo lek dendo bayar duit akeh percoyo tokici masker,-1,-1,-1
2640,jam pagi baru kerasa efek samping pasca vaksin nyeri badan ditambah meriang suhu badan panas diatasi dgn minum obat demam anti nyeri yg dikasi waktu vaksin oke mantap sehat mahal guys stay healty,1,1,1
2641,vaksin covid menurut gmn orangtua ku nolak mentah katanya vaksinnya tentu efektif baik tubuh krn indo vaksin yg dipake yg murah,1,1,1
2642,vaksin gratis gk ikut giliran bilang bayar protes sini kalian woy,-1,1,-1
2643,rakyat beli vaksin harganya jauh mahal nyetak sertifikatkartunya,-1,-1,-1
2644,gajeh turun udah langsung bayar cicilan en keperluan bocil bocil bulan jadwalnya bubu vaksin terakhir en momo grooming emak jajan,-1,-1,-1
2645,terpapar covid vit vit gk suplai dibikin murah smw org yg terpapar pasti minum vit,-1,1,-1
2646,seleksi alam kata yg enak covid skrng uang juga kalo kena covid berobat rumah sakit mahal negara manapun ga fasilitas enak paling nyaman pejabat ormg yg mempunyai privillage yg bisa mersakan yg nyaman,1,1,1
2647,asal org igt vaksin yg bayarjadah hahahahah,1,-1,1
2648,coba umumkan buaya rawat covid bayar kira pada abai mentaati prokes,-1,-1,-1
2649,dah ngabisin nanganin korona mon maap buat aja ya masker beli sndiri tes rapid swab dll bayar sndri bansos vaksin kabarnya hilang ditelan dinosaurus,-1,-1,-1
2650,vaksin sing gratis wae durung genah saiki wis kon bayar mesakake liyane po sing ning pelosok kae lho cok,-1,1,-1
2651,kangen jastip album murah temen mana cepet bgt sampe inanya soalnya kerja jadi bolak balik korina corona selesai buka jastipan,1,-1,1
2652,kalo lu gak takut covid tetep jaga kesehatan yaa ada lebih serem sakit biaya pengobatan nyaa rsud bekasi,-1,-1,1
2653,ternyata murah genose genose ini dipakai moda transportasi umum guna memastikan penumpang terbebas virus corona biayanya cukup murah,1,-1,1
2654,bilang vaksin gratis negara bayar woi pake ngutang,-1,1,-1
2655,yang bilang hati hati puskesmas rumah sakit yang sehat aja dipermainkan anggaran bantuan covid yg menggiurkan pulang didenda karantina bayar,-1,1,-1
2656,vaksin covid gratis tdk dipungut biaya,1,1,1
2657,klo gw pribadi vaksin harus bayar gw ambil gak demi sendiri keluarga orang sekitar itu gw rakyat indonesia bukan gw,-1,-1,-1
2658,vaksin harus bayar gratis,-1,1,1
2659,marahnya bapak dsuru vaksin tpi bayar rb pujungan,-1,-1,-1
2660,pokok nya gue wajib susu uht yakult hari karena apa emang doyan kebiasan tolong jadi bahan anti anti covid macem mulu napa tar langka terus jadi mahal aja panic buying orang tuh ih,-1,-1,-1
2661,kl pajakin yg gitu loh makanan pokok krusial bgt njir sektor kan kecuali situasi indonesia ekonominya dah stabil lg sebelum covid weh dpt kerja aja udh bersyukur lg pengangguran gimana beli makanan kl mahal,1,-1,-1
2662,vaksin yg gratis aja blm ada yg bayar,-1,1,-1
2663,sedih banget tetangga ku baik hati pindah rumahekonominya terdampak covidjdi terpaksa resign karna krja marketbar suatu mall buka usaha sndiri skarang trancam pindah rumah karna bilang ga sanggup bayar kpr rumah,-1,-1,-1
2664,jadi pengen mati kena covid jadi langsung ditanam ga ribet kira bayar sewa tanah nggak yaa,-1,-1,-1
2665,vaksin gratis ya nunggu antri pengen cepet ya bayar simple,1,1,1
2666,udah temen bilang tetangganya meninggal negatif covid dicovidkan rs bayar juta bawa pulang jenazahnya banyak percaya covid konspirasi ladang bisnis kalo kaya gini mumet gusti,-1,-1,-1
2667,corona gak sih baikan gua strugle bgt bayar ukt inj,-1,-1,-1
2668,awal pemerintah gausah nanggung biaya perawatan pasien covid pada bakal berhatihati,-1,1,-1
2669,hasil tol bunga hutang luar negeri pokok utang bulannya tol banyak menghasilkan masih perlu biaya covid delta terus mengganas minta biaya,1,-1,-1
2670,bangsat itukan rs memperlakukan nakes nya swab yg jelas bergejalanilai bayar tes mandiri nya lbh berharga kah banding pengabdian nakes yg saat masih setia bertahan makin yakin si kalo covid indonesia bisnis nya lbh besar dibanding kemanusiaan,1,-1,1
2671,harga tiket bioskop pas covid lebi murah tp ga dibolehin nonton,1,-1,-1
2672,honda pcx mahal bener emangnya buat tes corona,1,-1,-1
2673,pengen banget luar negri pls corona serius padahak tiket lagi murah banget coba kalo ga corona serius pengen banget,1,1,1
2674,dijual rumah murah harga covid klik liat harga kalau harga covid dah,1,1,1
2675,swab gratis sebenernya kasus covid orang banyak yang gamau test karena mahalga orang buktinya daerah rumah temen gua katanya orang gabisa nyiumgabisa ngerasain makanan dianggepnya penyakit,-1,1,-1
2676,tuan rumah sewa baik hati dikira rezeki kita jadi tuan rumah kena jadi baik hati kena fahamlah kan musim covid asalkan penyewa bayar sikitsikit selalu beritahu ada masalah,1,-1,1
2677,yg butuhkan beritakasusatau vaksin orang butuh makanbiaya pendidikan gratisdan kalo korupsi bagi,-1,-1,-1
2678,covid pergi gak si lu gue udah bayar ukt mahal mahal masa di rumah si,-1,-1,-1
2679,braw guys yg mengajukan keringanan disetujui nggak berharap bgt dpt krn skrg bapak positif cvd udh makan biaya rs tp ko ya gak acc sm kampus sih hadeh pdhl jelas terdampak covid udh disertain bukti cm senyum aja cont,-1,-1,1
2680,buseh vaksin pcv anak gw mahal yakkirain semahal nya ratusan ribu di atas sejutaastaghfirullah,-1,-1,-1
2681,ternyata sm allah dikasi menang uang arisan biaya covid bukan beliin hp wkwkwkwkwk,1,-1,1
2682,vaksin mesti pakai surab domisili bapak kosnya dimintain katanya gabisa ditawarin vaksin gratis gamau takut kena kalo vaksin suruh yg bayar aja yg gratis maunya sih woy,-1,1,-1
2683,zoo kalo vaksin kira bayarnya ya gasih yg biaya vaksin steril,-1,-1,-1
2684,pagi vaksin sore nya swab mantep sehat emang mahal bgt gaes semua tetep jaga kesehatan ya patuhi prokesnya jg,1,1,1
2685,heran orang suka bandingbandingin tar masuk pfizer nyesel masuk moderna tambah nyesel ya ampun byk yg divaksin tiap vaksin nya gitu ngumpulin duit aja sih vaksin bayar yg bagus dah gratis aja banyak ngeluh,-1,1,-1
2686,kr maaf kalo oot pengen ikut vaksin daftarnya dimana ya kena biaya ngga soalnya apa musti sertifikat vaksin,-1,-1,-1
2687,nganong mahal ang covid test hahaha,1,1,1
2688,vaksin bebayar pakai bpjs tidka ya harganya rb sama biaya rawat inap hari,-1,-1,-1
2689,orang kaya yg siap bayar mahal kamar rs krn covid jadi pelajaran orkay sebelum kena siapkan satu kamar yg berisi minimal tempat tidur setara igd siap dgn alat tabung oksigen dll,-1,-1,1
2690,penghasilan gue gak sejak kerjaan gue diputus akibat covid sblm pulang rumah gue udah niat ngasih ortu uang yg bekal puasa terus ternyata duitnya dipinjem separo kaka gue buat bayar hutang anjeng,-1,-1,-1
2691,vaksin kucing mahal banget,-1,-1,-1
2692,gua dah minggu kaga keluar rumah jalan udah hari mak gua ga pasar gara covid naik eh sodara gua dateng rumah batuk gua lockdown kamar rekomendasi tempat pipis murah,-1,1,-1
2693,gede bgt biaya melihara kucing yg kere gni bakal dong dahal cita pgn steril vaksin makanan yg bgs kandang bgs,-1,1,1
2694,kesel bgt ngeliat narasi vaksin kualitas terbaik smua vaksin tuh baik gausah kemakan omongan yg mahal yg baik dude,-1,1,-1
2695,mudik gak nanti seminggu lebaran mudik perbolehkan asal surat vaksin kabeehh varaksiinn harga mahalkeun nyuak mahal ge hayukeun da meh mudik gitu gak sih,-1,-1,-1
2696,yaallah test covid meni mahal,-1,-1,-1
2697,pemerintah singapura sdh melakukan digintalisasi dlm proses vaksinasi shg tdk tjd antrean panjang pemborosan biaya untuk pengadaan properti krn tempatnya menetap masyarakat daftar sesuai dg kesesuaian tempat waktu yg diinginkan ilmu mengorganisir acara scr mudah,1,1,1
2698,oksigen mahal tuhan kasih gratis smoga tuhan menjaga smua kita smua bs menang melawan covid amin,1,1,1
2699,pas bulan deh vaksin dpt si kent dpt pake yg gt demam sampe merintih bayar rb udh dokter bulan dptnya gue ganti yg ga demam juta dokterlho,-1,-1,-1
2700,zoo biaya vaksin untuk kucing pertama kali kira ya,-1,1,-1
2701,untuk persyaratan prokes diminta mudah naik kajj hanya cek suhu tubuh tidak memerlukan testing covid serta harga tiketnya murah kajj,1,1,1
2702,mulai ngeri krn udh bulan semenjak gue positif covid skrg tbtb sakit tenggorokan udh bbrp hari pusing batuk tugas gue skrg sih emg nyari negatifnya pcr bisa vaksin dosis kedua tp yaallah mahal jg kl pcr dlm wkt berdekatan terus,-1,-1,-1
2703,vaksin baiknya bayar aja yg kelas menengah mauan bayar,-1,-1,-1
2704,vaksin berbayar heboh didzolimi gak bayar ikut gratis,-1,1,-1
2705,emang impor alat test covid pcr dikenakan pajak ya ini pantesan aja mahal,-1,-1,-1
2706,yg vaksin cus cus cus mumpung gratis ngapain bayar,-1,1,-1
2707,sebenernya ga masalah vaksin berbayar asalkan sertifikasi surat vaksin ga pengaruh kehidupan sehari udah mah vaksin bayar tambah urusan nunjukin surat vaksin,-1,-1,-1
2708,dua yang menghalangi belanja ini covid jadi insinyur ngemall hangout dkk ongkir ga ikhlas bayar ongkir tetaplah yanuar,-1,-1,-1
2709,vaksin udah lapor spt udah bayar upeti tepat waktu kurang baik akutu warga negara,-1,-1,-1
2710,anak muda uangnya habis foyafoyasebagian habis buat swab antigen bayar vaksin,-1,-1,-1
2711,kodam diponegoro menyiagakan sejumlah rumah sakit militer seluruh jawa tengah diy rumah sakit rujukan pasien positif covid antaranya rumah sakit militer solo yogyakarta semarang tegal ini gratis tanpa pungut biaya,1,1,1
2712,tahun ngarep ppkm maneh vaksin maneh biaya maneh utang maneh mwuter ngunu terus sampe ono ideide perang baru hahaha,1,1,-1
2713,pemprov jatim menjelaskan konsentrator oksigen memenuhi kelayakan investasi biaya cukup efisien sebagai langkah cepat pemerintah mengantisipasi potensi lonjakan kasus covid,1,1,1
2714,daerahku kata nya covid banyak setauku disuruh pulang ngaku ngaku covid biar biaya rs gratistististis banyak,1,1,-1
2715,hah ngapasi orang orang takut vaksin giliran gratis takut giliran bayar protes ayolah vaksin gak efek yg dialamin orang,-1,-1,-1
2716,heran nanya gratis enggak vaksin emang gratis yah gue taunya sih gratis kalo bayar yang bayarin perusahaan institusi yang mengadakan vaksinasinya bener ga sih,-1,1,-1
2717,kebutuhan mahal gaji di murahkan alasan covid,-1,-1,-1
2718,masuk tiptop ngantrinya udh kaya ngantri vaksin mending pulang aja udah jajan alpa bodo mahal dikit pada jubel jubelan,-1,-1,-1
2719,obat herbal tempat terapi gue ternyata yg untuk covid diceritain yg ngurusin obatnya wisma atlet pasien covid yg minum kira seminggu negatif diselingi buah madu pantes obat gue mahal yg di tempat,-1,1,-1
2720,negara bayar mahal vaksin klo ujung nya gak mempan,-1,-1,-1
2721,kalo kantor ga nyediain vaksin gratis berarti bayar biaya vaksin ya harganya mahal ga,-1,-1,-1
2722,bulan vaksin bayar,-1,1,1
2723,saatnya penanganan pasien covid tdk ditanggung negara seperti batuk flu rawat obat tanggung selain tdk membuang anggaran jg menekan penyebaran warga lebih hati takut keluar biaya rawatobat hitung mengurangi penduduk,-1,-1,-1
2724,tau aja pemerintah belum gajian udh bulan temen gue endors covid jadinya hasilnya dua ya nda bayar kosan hahaha cepet sehat wak menjada kosan,1,1,1
2725,soll tanya misal isolasi rs rujukan covid gitu ada biaya nya rs solo kira penuh ngga ya yg tau infonya makasiih,-1,-1,-1
2726,hoax ttg chip dlm vaksin covid vaksin cairan sdg chip benda elektronik yg mahal sekecil apapun bkn benda cair yg mengalir vaksin lewat jarum suntik hoax tdk masuk akal kok dipercaya,-1,-1,-1
2727,di rumah udah vaksin pertama tinggal ntar lanjut kedua yg belom doang pls vaksin mandiri jgn mahal mahal,-1,-1,-1
2728,vaksin gratis dibilang palsu giliran bayar bilang pemerintah bu play enau negara lucu,-1,1,-1
2729,ngemeng kita gini giliran vaksin yaak gw sik ga ngarep gratis siksemisal bayar gppjangan pandemi kelar baru dapat vaksin yaak,-1,1,-1
2730,pak vaksin dpt polio untuk bayi bisa kosong terus berbulan bulan sejateng imunisasi dasar wajib itu kasihan bayi imunisasinya telat melulu kalo dokter tapi mahal pak,-1,-1,-1
2731,vaksin beli mandiri ya ketersediaan vaksin gratis tetap wajib jadi ga ceritanya kewajiban bayar vaksin covid,1,1,1
2732,tf ppkm selesai tgl kanapa jadi diperpanjangplis ppkm gn ortu pendapatan menurun bgt pdhl bntr lg hrs bayar kuliahan,-1,-1,-1
2733,yg virus gua tp vaksin ttp disuruh bayar aduh sulit kadang dipintain duit parkiran alfa aj gua ngedumel ini,-1,-1,-1
2734,vaksin bayar sukabrela jalankan yang uang biar bayar kasik premium layanan di tunda jangan memaksa rakyat wajib bayar vaksin negara tetap hadir vaksin berbayar,-1,-1,-1
2735,yg minta swab masal untuk acara nikahan tp pd minta tolong ga bayar alasan pelayanan gereja dok wkwkwkwkwkwkwkkwwkk gue tuh bingung kalo gini semoga vaksin abigail uang sekolah aldan bs gue bayar pake pelayanan wkwkwkwkwkwkwk,1,-1,1
2736,seminggu nunggu giliran vaksin tp belom dipanggil mentolo bayar ae larang pol anjeng,-1,-1,-1
2737,vaksin bayar yah hadeh masa kudu perebutan sm asn sih,-1,-1,-1
2738,vaksin berbayar mah masalahnya karena bayar nggak karena situasi kek gini vaksin kebutuhan dasar semua orang,-1,-1,-1
2739,kr ga sih vaksin mandiri puskesmas rumah sakit terus bayar ya gratis,1,1,-1
2740,kyaknya corona masuh nyerang indo gue ga bakal balik deh nanti alasannya swab nya mahal ya emg iya si satu org,-1,-1,-1
2741,mindset gini kencing aja bayar masa vaksin kaga,-1,-1,-1
2742,kr gasih kantor yg covid ngasih benefit karyawannya kaya biaya swab test yg direimburse kantor dikasih vitamin gratis gt sebulan,1,1,1
2743,usul pak menteri pasien covid bayar gratiskan biar orang gak menyepelekan enak bgt org yg awalnya gak percaya udah fitnah nyebarin hoax giliran kenak covid nyusahin negara negara yg di suruh biayain sakit jahat ya haha,-1,-1,-1
2744,gila yahh kirain biaya pemakaman pasien covid tanggung pemerintah udah biaya pengurusan jenazah doang rs jt terus ditambah biaya pemakaman jt kalo ina inu deui,-1,-1,-1
2745,ga kebayang pikiran orang terbawa opini obat ivermectin nyembuhin covid harga obat nya udah naik tinggi udah beli mahal mahal gatau nya tu obat gabisa nyembuhin orang tipes dikasih obat maag,-1,-1,-1
2746,pets kitten udh bulan ternyata owner blm vaksin biaya vaksin brp yaa terus sistem vaksin gimana yaa newbie,-1,-1,-1
2747,kalo aing jadi pemerintah tolak aja udah yg usul vaksin mandiri inidia niat ngumpulin cuan disaat kemampuan keinginan bayar masyarakat tinggi nyaorang kaya berharap vaksin mandiri dia dan,-1,-1,1
2748,vaksin gratiskan komentar jeleknya vaksin bayar komentar jeleknya,-1,-1,-1
2749,aduh berita vaksin bayar bikin mood anjlok jelek banget,-1,-1,-1
2750,final besok jadiin ajang uji coba stadion penonton kasih aja tiket official organisasi resmi supporter klub penyelenggara suruh tanggung biaya vaksin nya terus klub bantu subsidi biaya transpodan penginapan supporter,1,-1,1
2751,heran gue udh gk sekolah tatap muka setahun gegara corona tpi knp byran spp jojongdftr ulang jojong ngurangin biayaa mlh nambah biaya udh keadaan lgi nambah dipersulit temen gue sejujurnya pd gk setuju ktnya kasian ortunyatpi tetep aja bayar,-1,-1,-1
2752,corona biaya nikah murah blabla bulan madu murah lagi kalo ga skrng au ah blom jodohnya gimana,1,-1,1
2753,bayar pajak telat sehari udah didenda dicuekin terus diteror giliran vaksin kudu nunggu sampe season selanjutnya,-1,-1,-1
2754,gila salut bat gw untuk proses pcr hari udah tahap terahir loh setau gw prosesnya deh antigen katanya kalo hasilnya cepet nambah biaya pcrnya aja udah mahal cok udah selesai aja permainan ckckck,1,-1,1
2755,bisa nya orang kepikiran mending nikah pas corona biar biayanya murah anjir pas lu nikahan gue laporin satpol pp baru tau rasa lu,-1,-1,-1
2756,rs bisa menampung pasien covid pakai biaya pribadi ada gak sih,-1,-1,1
2757,dikasih gratis curiga disuruh bayar curiga,-1,1,-1
2758,woii biar tau ya vaksin gotong royong gotong royong dengan kawan jdi harus bayar,1,-1,1
2759,tips menabung menabung hari sejumlah angka baru covid hari juga mulai tahun sekarang tabungan kalian sudah satu juta wow murah banget indar kens kontol,1,1,1
2760,bear brand mahal dibeli vaksin gratis ditolak takut mati gara vaksin gak takut mati gara covid,-1,-1,-1
2761,ada yg udah vaksin pengen vaksin puskesmas gatau aku takut btw bayar ga sih,-1,-1,-1
