,tweet,bert_predict,lstm_predict,bert_lstm_predict
1286,eksperimen pikiran aja asumsinya lo beli vaksin yg kualitasnya blm dijamin tujuannya gue ga percaya vaksin terus muncullah embel produk anak negeri berbayar disitulah gue milih bayar lo gaperlu ngeluarin duit subsidi gue,-1,-1,-1
1287,gue baru tau biaya rs untuk pasien covid rs pemerintah swasta ditanggung negara setuju pemerintah banyak kurangnya tidak membuat gue lupa untuk tetap berterima kasih lagi terima kasih,1,1,1
1288,perusahaan jasa kurir pengiriman barang mengeluh minta kurirnya jabotabek ribu orang yg hari ketemu costumers rumah rumah divaksin sudah satgas covid dinkes dki menkom infomereka siap bayar tdk respon,-1,1,-1
1289,vaksin gratis ngeluh ga vaksin bikin sakit immun blablabla vaksin bayar ngeluh dibilang meras rakyat suka heran,-1,1,-1
1290,vaksin swasta aka mandiri ya mirip kayak swab yg provider cepet reliable mahal ada yang gratis hasilnya gt hari baru keluar ada syarat ga voluntarily,1,-1,1
1291,ga sih pemerintah duit bansosnya ganti jadi subsidi pcr test jadi lumayan tuh lebih murah trus warga warga pcr test mudah katanya pcr test gold standard covid emang iya,1,1,1
1292,vaksin tuh bayar gratis,1,1,1
1293,katanya perpanjang sim pake srtfkt vaksin bayar pajak kendaraan pake jg urus ktp pake juga bayar pbb pake jg yo wisgak usah sim gak usah byr pajak,-1,-1,-1
1294,uang pajak triliunan utk kperluan covid pemulihan ekonomi tp pegawai ne antigen msuk kantor biaya sndiri aowkw,-1,-1,-1
1295,tau ga sih klo biaya perawatan covid sangat mehol belom klo yg punya komorbid coba klo yg punya asuransi ngobrol sm agent nya deh,-1,1,-1
1296,gara astrazaneca gak jelas indonesia harus atlet badminton yg jadi pelampiasan hidup gak sebercanda keles mending gak perlu dilanjut vaksin astrazanecanya udah mahal gak gunannya nooh kasus virus baru inggris jadi buktinya,-1,-1,-1
1297,orang beli vaksin harga segitu udah vaksin duluan gak mampu mending belabelain antri gratis bayar gak buat booster semoga gak laku,-1,1,-1
1298,orang diendorse covid si covid bayar pake,-1,-1,-1
1299,biaya lockdown minggu biaya rawat pasien covid tahun,-1,1,-1
1300,vaksin sinopharm memang diperjualbelikan awal dijadikan vaksin gotong royong dealingnya tetep pemerintah perusahaan yg tetep bayar pemerintah mengvaksin karyawan mereka,1,-1,1
1301,indomie satu nya produsen covid test penjual hape dapet untung dimasa pandemi makanan murah kenyang ya indomie,1,1,1
1302,merasa salty orang yg sengaja malsuin hasil swab jadi positif covid aslinya engga positif biar kantornya ga bayar pajak sumpah ya kalo udah kena covid ketawain lu biar tau rasanya swab berkali kali belom negatif gimana rasanya,-1,-1,-1
1303,ppkm mayoritas masyarakat menengah bawah artinya menutup income jalan halal biayai kebutuhan pokok bayar utang buka pintu stre depresi modyar nasibnya rakyat selamat mati covid mungkin nggak selamat kelaparan gila,-1,-1,-1
1304,vaksin bayar negara gratis gratis takut jadi kelinci percobaan maunya indonesia heran deh,-1,1,-1
1305,vaksin salah satu kunci penyelesaian wabah tp harus bayar rakyat susah niat menyelesaikan tdk,-1,-1,-1
1306,direncanakan lebaran idul adha dirumah bayar tiket pesawat gatau ga jadi hari ada ppkm terus dipaksain pulang belum vaksin mau vaksin takut jarum wkwk dahlah,-1,-1,-1
1307,takut vaksin karna demampanas smisalnya org lupa kalo anaknya jg vaksin campak lainlain efeknya jg sperti janganjangan anaknya kaga vaksin ya atau vaksninnya yg maharani mahal jd efek sperti atas gag bgitu nampak,-1,-1,-1
1308,akhirnya covid jadi guru yg killer ketenangan hidup sehat mahal kalo sakit jadi kudu punya tabungan emergency tanggung jawab diri terima kasih terutama diri hargai org ingat mati bersyukur serakah positive thinking,1,1,1
1309,opsi ppkm melepas tanggung jawab negara rakyatnya dipakai opsi uu kekaratinaan bukti nyata biaya hidup bertambah tatkala menyokong warga terpapar covid isolasi mandiri,1,-1,1
1310,vaksin tp batuk dikit tuh ga si gua awal bulan vaksin gajadi keburu bayar ntar,-1,-1,-1
1311,bayangin bayar vaksin ribu terus blm lg bayar pcr sma antigen duit jg ya ada tapi utk makan bapak ibu untuk biaya dll,-1,-1,-1
1312,kan tinggal pilih vaksin yg grati klo gamau bayar wkwkwkkw gratis aja udh pd abis,1,1,1
1313,oke ngeles mertua ga tedak siten duitnya dipake vaksin influenza aja hehehe bayar pbb,-1,-1,1
1314,isp bumn dah vaksin ngok ketidakadilan yg nyata bayar pajak sama sama cari untung dr masyarakat,-1,-1,-1
1315,vaksin percaya duit janji bayar percaya,1,-1,1
1316,boyfie rent untuk tmenin vaksin bayar perjam antri vaksin seharian sampe sore jam pagi wkwkwk,1,-1,1
1317,sampe skrg kepikiran ada warung bubur buka pas ppkm terus kena denda jt pemiliknya kaget terus meninggalbukan covid warungnya sepi biaya kontrak ruko mahal kasian banget asli,-1,-1,-1
1318,waktu kent vaksin bulan gue nyoba puskes wajib jadi ada sempet nanya dibidan kalo dibidan puskes bayar rb bayar pendaftaran doang wk,-1,-1,-1
1319,mencegah mudah baik murah pada mengobati,1,1,1
1320,tiba kepala pusing kirain efek vaksin ehh ternyata pusing abis bayar tagihan gaji numpang lewat,-1,-1,-1
1321,vaksin dibeli bebas dibeli pengusaha kerjasama rumah sakit hasil vaksinnya tambah mahal,-1,-1,-1
1322,coba pemerintah bayangin deh kalo vaksin bayar orang kampung gua bayarnya pake hasil bumi enggak,-1,1,-1
1323,dinangor diunpadnya layanan vaksin ga si apakah bayar kalo bayar brp ya,-1,-1,-1
1324,jadi alasan covad covid terus lupa bayar listrik,-1,1,-1
1325,covid pnyakit sangat mahal ampun gusti alim deui,-1,-1,-1
1326,sih susah banget disuruh vaksin bayar kaga susah payah pemerintah dptin vaksin woi gw vaksin kaga aja ngiri liat yg di vaksin suntik rabies nih kzl,-1,-1,-1
1327,gek vaksin covid trs hpv huhu bismillah ya allah vaksin hpv ga murah lancarkan rezeki hamba aamiin,1,-1,1
1328,sinovac ga diterima negara tujuan jadi vaksin minimal astra zeneca sebaiknya bayar aja ya kasian yg dapet masa vaksin,-1,-1,-1
1329,gue gabole meninggal karna covid harus pull albedo amos bow harus bayar welkin bp blom liat inazuma mau yae gw semangat hidup,-1,1,-1
1330,ngomongin vaksin bayar sdh jalur damainya minum ct murah rb ori langsung auto negatif,1,-1,-1
1331,ayo senor ketatkan pengawasan ada vaksinasi swab bayar perintahkan polri untuk menangkapnya karna vaksin swab gratis semestinya,1,1,1
1332,blm dapetan vaksin udh aja berita vaksin suruh bayar,-1,-1,-1
1333,bgr cara daftar vaksin daerah bogor kota gimana ya terus tempat vaksinnya dimana bayar kah,-1,1,-1
1334,bener ga sih klo mo perpanjang stnk mesti punya kartu vaksin beeuuh malesin klo iya mo bayar pajak aja gitu viral urus sim skck pny kartu vaksin tp hoak,-1,-1,-1
1335,emg jaman vaksin gratis klo da bayar dala sian,-1,1,-1
1336,kcg vaksin kucing dewasa mahal nggak ya nabung kmrn habis steril disalty yaa hehehe terimakasih,1,-1,1
1337,dapat jatah vaksin ya jujur lumayan hemat biaya tes antigen skeptis dgn sop yg di testimoni warga lokal disuntik bengkak jadi trauma datang,1,1,1
1338,pets biaya bersihin kucing bersihin kutujamur vaksin sm pengobatan brp ya kira rumah ku satu stray cat suka makan mau ak bersihin niatnya sih tp liat budget dlu,-1,-1,-1
1339,perusahaan labanya persen corona pernah nambahin gaji pegawainya skrg kalau labanya seret buru ga bayar gaji phk,-1,-1,-1
1340,mubeng jakalpalagangejayanpakem golek obat nggo seng positive covid ra ketemu wkwkwk jaga kesehatan ya gaes obatnya mahal sekale cara minumnya sehari minum tablet di hari pertama hari berikutnya tablet,1,1,-1
1341,saham arb serentak dah seminggu berturut sbnrnya bagus yg blm masuk dikasih murah yg udh dalem wakakakakaka duduk manis aja ya memantau punya gw jg yg nyangkut tp tetep blm dibanding pas awal corona ngalamin ga anjlok sampe,1,-1,-1
1342,mahasiswa aktif upi dapet vaksin gratis kampus gak gak dapet tagih itu ukt kalian bayar mahal lho,-1,-1,-1
1343,vaksin bayargratis pemerintah udh janji akn menggratiskan tp prcepatankeamanan kenyamananekonomi kembali sgr pulih gada salahnya swasta libatkan jg dlm penyediaan jd versi gratis ttp bayar pemerintahbumnswasta buka aja tp dg pngawasan pmrintah,1,1,1
1344,instagram yg pro vaksin bayar sugehsugeh,-1,-1,-1
1345,ya allah dah nyerah nyari vaksin gratis wis gek cepet dateng aja pfizer bayar wis gapapa skrg isoman krn sehat ada org yg bs dipercaya luar,1,1,1
1346,mantep vaksin berbayar gue ngerasain bgt efektivitas pelaksanaannya vaksin berbayar dr kantor keluarga yg kaya nyokap kesulitan bgt dpt semoga vaksin berbayar gitu jg gapeduli gue bayar ngarepin efektivitas dari negara birokrasi ck,-1,-1,1
1347,domisili luar pulau tu seneng klo tugas jkt sisan blanja yg murah jawa tp sblm corona stlh corona nek entuk tugas luar kota nek iso didongani rasah sido mangkat krn rebyek ndadak karantina ndadak swab pft,1,-1,1
1348,banyaknya berita penting harini pelastine covid vaksin melaka banjir susu mahal raya habis resepi kejayaan,1,-1,1
1349,awal darurat militer diterapkan situasi covid indonesia terkelola terpola biaya terkendali sejak awal prof yusril mengusulkan soal darurat militer prof yusril mengambil contoh philipina,1,1,1
1350,sape tau kat antigen covid test murah,-1,1,1
1351,vaksin gratis dah habis kalo bayar,-1,1,1
1352,baca komenan cuitan dokter gue yg share bidan yg meninggal karna ibu yg melahirkan ga bilang kalo covid terus komen arah covid mahal dll dalem hati kalo ga punya duit kayanya kemungkinan lahiran harbun dahh asli orang komen skrg tuh,-1,-1,-1
1353,rakyat sudah pelanpelan mengambil alih penanganan testing pencegahan lockdown sukarela rumah pengobatan sekarang bayar vaksin ada,-1,-1,1
1354,vaksin bayar tes swab bayar udah bayar ada kemajuannya oh,-1,-1,1
1355,ya allah adek gua nge vaksin mahal bener sejuta setengah,-1,-1,-1
1356,gila ujungujungnya vaksin jadi barang khusus kaum elit udah word nya dibilang penyakit orang kaya swab mahal vaksin nya dibeli monyet,-1,-1,-1
1357,udh gila kali vaksin berbayar lagi mahal bgt bangsat,-1,-1,-1
1358,gilak obat covid mahal bgt ya okelah mahal kalo tersedia eh udah mahal susah dicari,-1,-1,-1
1359,lantas dgn jalan keluar utk yg tdk vaksinable tp sejatinya sanggup mau keluar biaya ini rada rumit krn dlm situasi darurat mana pasokan vaksin terbatas,-1,-1,-1
1360,ak playing victim gais katanya gak sekolah iya sih spp emng mahal bgt uni ku gamau ngasih keringanan pas corona,-1,-1,-1
1361,buset vaksin beneran bayar untung dah vaksin,-1,1,1
1362,krisis oksigen beberapa rs indonesia sdh pasien covid yg tertolong oksigen tabung langka mahal hrus usut menkes hrus pro aktif di negara luar jk kasus sperti menkesnya mengundurkan diridi indonesia smg solusi,-1,-1,-1
1363,er gais sesape tau swab test covid murah sket huhu,1,1,1
1364,antigen bayar pcr bayar obat beli mandiri skrng vaksin jg bayar hehe,1,-1,1
1365,vaksin cepet pas ppkm susah uda daftar tp blm dpt jadwal semarang ga sih yg cepet bayar gapapa asal jgn vaksin bandara yg bawa pcr beli tiket pesawat,-1,-1,-1
1366,jadi presiden berat udah vaksin gratis cina gak bilang antek cina murah giliran yg berbayar bagus bilangnya corona bisnisin,1,-1,-1
1367,kebanyakan orang takut bayar rapit sama covid,-1,-1,-1
1368,zoo biaya vaksin ucing betina usia bulan ya vet,-1,-1,-1
1369,ppkm diperpanjang orang jualan sepi beli tida yang beli tida punya uang imun turun tida uang solusi yg udh vaksin dikasi segepok duit pemerintah meningkatkan imunitas stengah stengah beli vitamin mahal bouus,-1,-1,-1
1370,uang rakyat al dibuat bayar gaji aparatbeli vaksin dll mnuu,-1,-1,-1
1371,kata hujatan elo pak presiden smoga berbalik diri lo tungguin aja elo kena covid bayar ya,-1,-1,-1
1372,dihitung ya biaya pas gue kena covid sama kaya ukt semester gue njir alias mehong bok,-1,-1,-1
1373,banyak ngomong vaksin suru bayar emang iya ta,1,-1,1
1374,kalo karena biaya rapid sekeluarga bolakbalik mahal bakal ngotot corona pergi jogja plis sudah bosan dikamar,-1,-1,-1
1375,gausah ribet masalah vaksin bayar tenang aja ada vaksin gratis gunain kesempatan secepatnya kimia farma berbinis biarin aja yg punya duit cepat bayar gamau bayar ya sabar prosesnya gratis minta cepat sabar agustus vaksin pfizer datangampitu,1,1,1
1376,merbabu swanting syaratnya genose murah nek konangan le covid pie mah rasido munggah eh,-1,1,1
1377,vaksin bulan udah bayar,-1,1,1
1378,maaf pak betul beban biaya vaksin untuk karyawan swasta mohon penjelasannya,-1,-1,-1
1379,habis bayar paylater serasa kena covid sesak nafas,-1,-1,-1
1380,bukan vaksin steam cell biayanya puluhan ratusan juta alias ga murah pejabut yg makai mereka berani skip preklinis ganti bumbu dr terapi steam cell kanker tp tetep intinya cuma buat yg kaya,-1,-1,-1
1381,yg berargumen mau divaksin masa percaya aja dikasih vaksin gratis vaksin bayar si anying beuki ngacapruk,-1,1,-1
1382,positifnya corona tiket pesawat murah aja,1,1,1
1383,ne teruntuk babu kocheng biaya vaksin puskeswan berapaan ya kira,-1,-1,-1
1384,kcg biaya vaksin kira kira habis ya tolong dijawab,-1,-1,-1
1385,kalian lagi cari buku sekolah murah cek di shopee tengkiu,1,-1,1
1386,harga tes aja mahal lagi vaksin disuruh bayar susah emang rezim pembunuhan ma al,-1,-1,-1
1387,mah masuk univ mahal mahal kalo pas corona,-1,-1,-1
1388,lucunya gamau karyawannya kena covid karna gamau sampe perusahaan tutup kalo kedengeran buyer kalo yg sakit periksa trs isoman gaboleh karna gamau bayar yg istirahat dirumah deh ku bisa tersenyum mbe ngelus ndas wkwk,1,-1,1
1389,halah kontol dikasih vaksin gratis ngamuk ngamuk takut dijadiin percobaan jadi tumbal takut dijadiin proyek depopulasi giliran yang bayar ngamuk ngamuk disebut biadab itu dengan yang bayar bantu naikin persentase vaksinisasi,-1,-1,-1
1390,bilang sakit covid endorse covid maaf nih ya pcr sampe menuhin kebutuhan hidup bayar dapet suppodari temen dan keluarga,-1,-1,-1
1391,ternyata ada loh warga yg nolak rumahnya disemprot desinfektan udah jelas positif covid ga bayar aja rewel kabar disuruh bayar,-1,-1,-1
1392,hindi natin nakikita ang covid virus kaya todo ingat na rin ito sa kaligtasan ng iyong mahal sa buhay,1,-1,1
1393,vaksin nggak maugiliran pilihpilihdikasih yg bayarkatanya gratis yukngene trus sampe lebaran kuda,-1,1,-1
1394,lingkungan rumah ku kek rata udh prnh kena covid rumah mertua rumah ortu tetangga jd kyk pasrah aja skrng emak saat ktemu org suami kerja kantor ktemu org bapak kalau bayar pensiunan org rame mertua gtu kerja luar rmh ktemu org,-1,-1,-1
1395,kaya menyesali gt gajiku kepotong itu cukup bgt bayar pajak loh kembali serebu aku dah berusaha ikhlas bersyukur gitu seenggaknya ga dipecat corona lu sih disuruh anteng rumah kaga nurut bajing,-1,-1,-1
1396,pandemi covid entah bisa berangkat haji daftar indonesia semoga allah hilangkan wabah memberi kesempatan berangkat haji swedia balik indo murah onh plus dan langsung berangkat antrian,1,1,1
1397,siang baru tau vaksin gr dibatalkan jokowi punya karyawan dgn yg sdg dirumahkan vaksin sudah kejar sini vakgor adlh alternatif roda ttp berputar saya siap bayar anjjng seanjing nya sjw menara gading,1,1,1
1398,perang melawan wabah kita gak terus mengurung sembunyi krn takut wabah dilawan dg senjata dan senjata adalh vaksin smkn yg divaksin akan terbentuk kekebalan kelompok jadi ga perlu ribut vaksin gratisbayar penting vaksin,1,-1,1
1399,korban meninggal penyakit diabetes saja jauh banyak sekarang seandainya untuk tes gula darah biayanya rp ribu juga covid korban ditekan biaya swab antigen pcr nggak kebangetan mahalnya sekarang,-1,-1,-1
1400,sekretaris jenderal perhimpunan rumah sakit indonesia lia gardenia partakusuma bilang klaim biaya rs rujukan covid kemenkes januari mei capai rp triliun,-1,-1,1
1401,serem semalem mimpi positif covid kena biaya rawat inap semalem doang jt,-1,-1,-1
1402,mau mudik nantipernah gak berfikir pas otw kampung wajibkan vaksin harus bayar ngantri,-1,-1,-1
1403,ppkm sekala mikro ke desa mudah mudahan kementerian desa aturan pembelian alat genose covid pakai dana desa jadi masyarakat mudah pengecekan covid biaya murah,1,1,1
1404,tagline ngajak vaksin yg terbaru eh ayo buru vaksin mumpung gratis dripd disuruh bayar loh hahaha ampuh jg,1,1,1
1405,zoo nanya biaya vaksin kucing ya steril berapa tuh masingmasingnya ya thanks,-1,-1,1
1406,tenggorokan gatel bikin pengen batuk mulu kontak erat suspect covid auto parno rapid antigen alhamdulillah negatif gatel tenggorokannya ternyata efek minggu abisin gr kwaci covid nih ya bikin sakit jadi mahal tegakin diagnosis doang,-1,-1,-1
1407,susu beruang udah harga mahal cuy mending vaksin grati,-1,-1,-1
1408,ambil budget berbillionbillion untuk beli vaksinlast rakyat bagi vaksin yg murah,1,1,1
1409,gw heran knp pd rame protes vaksin gotong royong biarin ajalah yg emg bayar wna perusahaan pribadi bs bantu ngurangin pengeluaran negara kn cm opsi ga ush mikir kmn sampe blg ancaman keadilan sosial indonesia sih,-1,-1,-1
1410,pada masalahin vaksin hw menurut gw membantu menyebarkan vaksin gak bayar,-1,-1,-1
1411,kalo emang vaksin bawa surat keterangan domisili surat keterangan kerja kantor ya udah sik lu urus aja udah dikasi vaksin gratis banyak cingcong anjir ntar disuruh bayar nyalahin pemerentah,-1,1,-1
1412,nya mikir pengen donor plasma stlh negatif covid syarat donor plasma hrs menyertakan surat ket pcr positif pcr negatif aku ga dapet fasilitas untuk pcr pcr mandiri mikir mahal brou,-1,-1,-1
1413,perasaan waktu pemerintah banyak beli vaksin sinovak murah dah napa banyak yg pake astrazeneka ya,-1,1,-1
1414,pengalaman mas ku kmrin rawat inap covid ditanggung kemenkes nya obat infus pcr msct thorak segala test tapi utk kontrol nya biaya kl asuransi rs nya kerjasama sih bpjs nggak dipake cerita ya,-1,-1,-1
1415,emng covid memakan bnyk biaya,-1,-1,-1
1416,kronologi pasien suruh bayar rs ngamuk kabur dr rs skrg udh gratispun kabur tahun blm vaksin berisik nuntut hrs cepat skrg vaksin gratis menolak krn mencurigakan klo berbayardibilang pemerintah berbisnis sm rkytnya trus piye,-1,1,-1
1417,yg gratis vaksin bayar ya biarin aja kan pilihan dikembalikan kita inget masih ada vaksin gratististis,-1,1,1
1418,rakyat dihadapkan pilihan maju kena mundur kena tetap beraktivitas mencari nafkah dgn resiko terinfeksi covid diam rumah tanpa penghasilan dibebani biaya penghidupan seharihari minta tolong siapa pinjol,-1,-1,-1
1419,daftar vaksin gratis ga gelem jare pemerintah membunuh rakyat giliran onok vaksin bayar jare pemerintah memikirkan rakyatnya repot jum jum,-1,1,-1
1420,reaksi hari kedua covid pilek batuk mencret kaya murah meriah mencret,-1,1,-1
1421,jualan vaksin digunakan biar orangorang pikiran harus bayar mending cari gratis jadi mau deh divaksin tumben husnudzon wkwkwk,1,1,1
1422,semoga duit endors covid cepet masuk mayan bayar ukt kampus,1,1,1
1423,jujur beberapa kekhawatiran kalo baru vaksin bulan ketersediaan vaksin tempat penyedia vaksin biaya vaksin idup engga,-1,1,-1
1424,aja orang cari alasan gabisa bayar hutang kemarin pagi udah janjian kalo bayar hari tp pas dihubungi barusan tiba banget bilang kena covid lg isolasi,-1,-1,-1
1425,gw pikir dgn vaksin berbayar semoga yayasan galang dana beli vaksin vaksinkan orang terutama miskin harus kerja perusahaan terdorong bayar ngasih vaksin pegawainya harus masuk,-1,-1,-1
1426,vaksin berbayar kimia farma dibatalkan vaksinasinya jalan terus kok tetep disuntikkan bayar pemerintah kimia farma gratiskan kan ketahuan punya stok vaksin kenapa ditahan,-1,-1,-1
1427,vaksin covid tidak berbayar penduduk indonesia berhak mendapatkannya biaya sepeserpun,-1,-1,-1
1428,vaksin gratis bilang buangan giliran suruh bayar bilang bisnis kerjaan nya ngeluh bilang negara udah bebas covid kok negara belum ya orang orang nya disuruh taat protokol di vaksin aja susah banget wkwkw,-1,-1,-1
1429,sampai perpanjangan ppkm darurat takutnya malah sehat orang orang mlarat bisa wafat karena terjangkit covid cari biaya makan sulit orang orang kelaparan ada bantuan signifikan,-1,-1,-1
1430,wal sakit hati bnr melihat kuitanku bayar kuliah lwn kosanku membongkar tabungan sidin pendapatan thun kd kya thun covid jr sidin wayh ada pacah toko syukur,-1,-1,-1
1431,ngomongin bts mama trus tiba nanya harga tiket jakarta korea pas gw tanya nanya tibatiba kangen katanya murah tiketnya kalo covid gini karantina singapore korea ga makan waktu,-1,-1,-1
1432,kalo baca tweet orang yg mempermasalahkan sinopharm sdh dibeli untuk umum ternyata rendah banget informasi diterimadiketahui masyarakat ya contoh nya vaksin bayar kf diberi hak untuk distribusi mah nyimak aja deh,-1,-1,-1
1433,pemerintah bergegas sedih vaksin ok intinya bgmn kebijakan penanggulangan wajah secara keseluruhan cuma vaksin hrsnya dari lockdown sediakan tunjangan semasa lockdown perusahaan pemerintah hrs bahu membahu bayar gaji karyawan lockdown,-1,-1,-1
1434,kerja kerja kerja positif covid kerja lah yakali ngapain buat nutup biaya kebutuhan isoman,-1,1,-1
1435,disisi hidupnya udah tergolong cukup gausah mikirin besok makan gimana ga usah mikirin bayar itu justru mengeluh keadaan covid berasa hidupnya sengsara cuman karena gak nongkrong jalan bebas ga ada aturan,-1,-1,-1
1436,nasib pelaku umkm kena pajak restoran penjualan kotor dimana tidak dibebankan pembeli ditalangi penjual kena npwp harus bayar penjualan kotor dinas mah tutup mata gak peduli musim corona nggak hajar terus pajaknya,-1,-1,-1
1437,adek gw baru mulai kerja ga wfh riwayat asma dilarang tp dia butuh utk biaya kuliah selama gw yg bayarin semoga utk semester gw blm krn satu lain rasanya pengin gw geprek penjahat covid ga otak gitu,-1,-1,-1
1438,bener vaksin bulan bayar,-1,-1,1
1439,yg giring opini vaksin jadi bayar si anjing kontol seharusnya tenang jadi keos anjing anjing,-1,-1,-1
1440,karena kasus covid naik yaa skrng yg menyangkut liburan jadi mahal,-1,1,-1
1441,belakangan indra penciuman kehilangan respon aroma makanan mahal panik tuh ku kira covid ternyata tanggal tua penyebabnya,-1,-1,-1
1442,anxiety hari disponsori itungitungan biaya harus dikeluarin sampe salah satu orang rumah gw kena covid,-1,-1,-1
1443,murah vaksin berbayar tinggal nyari anak nih berbayar hayu yg penting dapet,1,1,1
1444,bodo mau vaksin gratisbayar yg penting tersedia,-1,1,-1
1445,byk tmn sakit cenderung bingung yg mesti dilakukan pertamatama yg muncul pertanyaan covid ato gak ya smntr gak bisa dianjurkan langsung pcr karna blum ada yg daerah jg gak murah,-1,-1,-1
1446,turun perintah refocusing malah sendiri kode rekening bantuan sembako warga isoman biaya pemakaman covid berarti kan lagi trend,-1,-1,-1
1447,perlu mikirin laju pertumbuhan ekonomi yg klaim maju sdgkn kenyataan nol besar yg utama pikirin covid pikirin bayar hutang rs biar rs menyiapkan tabung oksigen pikirin nasib rakyat yg lg kesusahan mrk ngasih buat keluarga mrk,1,-1,1
1448,yang tahu hitungan sumbangan vaksin gotong royong kadin ga sich katanya mahal yah,-1,-1,-1
1449,gak pejabat nya gak masyarakat nya corona dijadikan ajang cari keuntungan pribadi anggaran dikorupobatsusu kelapa ijo mahalpusing pala aliando,-1,-1,-1
1450,lucu deh pas vaksin yg gratis alasannya macemmacem ditanem chip yang konspirasi belum vaksin ga percaya vaksin merasa vaksin lah jalur gratis jalur bayar ribut sampeyan gitu kelakuan bajingan celeng asu,-1,1,-1
1451,pernah bayar swab pcr fasilitas negara untuk rakyat nya bayar covid lagi urgent bisa diputus rantai penyebaran nya,-1,-1,-1
1452,covid naik berarti ekstra sabar jntuk dapetin kerjaan bisa biaya hidup ku,1,1,1
1453,min fasilitas keringanan biaya kah yg pingin ikutan donor plasma kebetulan ab pingin ikutan donor plasma abis kena covid kmrn swab nyamihil nih,-1,-1,1
1454,lepas tu alumni um perangai mcm tu bilang pesakit covid tu tipu lakonan bilang kena bayar kunun nda tau ada wayar putus kali kepala tu,-1,-1,-1
1455,biarkan corona terus berjalan aku mencintaimu menghibur semua ingat sanak bahagia mahal loh paach orang mikuumm ashhiaapp pemain piguran mauk brb,1,-1,1
1456,mahalmahal beli lapak makam san diego hills eh meninggalnya garagara covid,-1,-1,-1
1457,vaksinasi gratis masyarakat madani gak vaksin gk kebayang kalo bayar untuk vaksin sarap sarap,-1,1,-1
1458,lagi usaha koh digrebek haha untung percetakane mblesek njajal neng cedak jln jensoed yawis kukutan hayukk pengusaha sing digaruk rasah gelem bayar pajek maning bpjs nunggak sit bae ehe ehe vaksin uwis lockdown uwis pemerintah rep pakani karyawanku ora,-1,1,-1
1459,ya gmn yaa skrg kasus covid naik bnyk tp nakes ga digaji bln mbok ya dikira nakes ga mangan bayar tagihan taa blom yg udh punya anak,-1,-1,-1
1460,happy weekend buka toko gaes cari duit musim corona tagihan tetap bayar kontrakan tetap pemasukan berkurang,1,-1,1
1461,semenjak vaksin digencarin swab antigen pcr udah bebas akses dimanamana tetep bayar setelah vaksin apa ya jadi ga sabar vaksin jadi obat bebas konsumsi,-1,-1,-1
1462,qadrun lama bikin pusing vaksin gratis jg gak bakalan di vaksin krn vaksin china vaksin berbayarmereka teriak vaksin bayar itu yg berbayar bukan utk qadrun krn gak sanggup bayarnya kalian sih drunn gimana drun,-1,-1,-1
1463,biaya pengobatan covid di tanggung,-1,1,-1
1464,vaksin gratis buat memperpendek umur mikro chipnya permainan elit global biar kaya vaksin bayar vaksinnya mahal banget bikin rakyat menderita yg miskin makin di tindas tai,-1,-1,-1
1465,ada negara dunia akan mengendalikan covid meningkatkan jumlah tempat tidur oksigen ventilator ruang icu solusi hanya mustahil sangat mahal memang infrastruktur layanan kesehatan jawabannya negara,-1,1,-1
1466,pengen vaksin mandiri dimana ya rakpo wis mbayar mahal,-1,-1,-1
1467,ternyata biaya imunisasi rsia bina medika sm rspi beda rb doang ya mending rspi deket klo binmed pake tol rb jd rebu ya mahalan binmed hahaha gk tau ya perbandingan harga vaksinnya soalnya tiap dateng beda vaksin,-1,-1,-1
1468,mendengar skema vaksin gotong royong tim sempat mendiskusikannya sepakat ikut pada itu susah memahaminya pakai prinsip keadilan masih kelompok prioritas dapat mosok kita bayar kita dapat,1,-1,1
1469,ini yg untuk memenuhi makanan sehari susah org yg sy tau terpapar covid tdk isolasi dgn alasan tdk uang utk berobattdk uang utk bayar airtdk uang utk byr listriktdk uang utk cicilan,-1,-1,-1
