,tweet,bert_predict,lstm_predict,bert_lstm_predict
3630,pesawat mengangkut ton bantuan darurat kesehatan pemerintah uni emirat arab uea tiba untuk membantu pemerintah indonesia mengatasi melonjaknya kasus infeksi covid varian delta jumat hari bantuan kadrun lhoebong kemana,-1,1,-1
3631,covid naik daun berhasil membuat aq takut dikit hehehehe,1,1,-1
3632,bantu pasien covid erick thohir plasma bumn,1,-1,1
3633,sayaangg kemarin izin ga ngetweet soalnya udah bener lelah banget mikirin masalah ekonomi keluarga kan covid jadi cukup berat terus kepikiran kuliah juga gara mana moa sakit bantu jualan biar duit pegangan gausa dikasih,-1,-1,-1
3634,panglima tni marsekal hadi tjanjanto dlm arahannya memberi apresiasi perhatian tinggi atas keberhasilan pemkab kediri lamongan berhasil menurunkan laju penyebaran covid wilayahnya,1,-1,1
3635,bu acih ibu tangguh penyala ekonomi mari bersamasama bantu keluarga tangguh runridesia pandemi covid memberikan banyak sekali dampak kita,1,1,1
3636,sampe bersyukur banget nyokap selamet dr covid gejala medium pas sebagian pasien lantai ada yg pake alat bantu napas ada yg berpulang di rs,1,1,1
3637,membantu saudara saudara terdampak covid ppkm bisa bentuk berbagai salah satunya donasi applikasi nya memudahkan banget yg sedekah qurban pedalaman masyarakat terdampak ppkm masih lagi recommended,1,1,1
3638,inget banget crsh rl kalo gua ultah kalo berhasil masuk sekolah dia pengen sama sama nraktir makanan eh tau taunya corona agrhhjshhe benci banget,-1,-1,-1
3639,beneficial ownership registry kayaknya membantu menekan penyebaran hoaks soal melacak orang diuntungkan penyebaran hoaks misal orang nyebar hoaks makan lele menyembuhkan covid lacak bo registry tau ternyata peternak lele,-1,1,-1
3640,apasi lg kek gini boro pgn nongki tp ada aja temen yg ga mikir maksa nongki bkn masalah ga solid gue cm gamau bantu penyebaran covid babi aja,-1,-1,-1
3641,menteri kesehatan membantah kabar indonesia mengalami kolaps pemerintah pusat berhasil mengendalikan kasus covid indonesia butuh waktu cukup dan butuh kesabaran untuk mengendalikan kasus covid indonesia,-1,1,-1
3642,gak takut covid covid baik membantu orang berguna sepertiku untuk mati cepat ribet bunuh cuma masalahnya takut nular orang,-1,-1,1
3643,koarmada ii kata doi tergerak membantu ribuan tempat tidur baru sebanyak personelnya terpapar covid nmun hrus antre igd rsal dr ramelan surabaya membutuhkan perawatan medis,1,1,1
3644,berhasil kah sukses berkat daring,1,1,1
3645,wejangan pimpinan kadrun untuk melawan kebijakan pemerintah menekan pandemi covid berhasil banyak kadrun terinfeksi jadi korban,-1,1,-1
3646,masi seputar maba scrub warna warninya hari bantu vaksin atma bsd nemu orang pake scrub army pink duduk meja screening,1,-1,1
3647,guys yg paham bole bantu saran ya vaksin astrazeneca tp punya darah tinggi boleh ya,-1,-1,-1
3648,covid virus berbahaya virus dapat nembunuh logikaakal sehat kemanusiaanada gejala berkembang yaitu mematikan kasih sayangserta dapat melumpuhkan ekonomi rakyat yang berhasil sempurna dukendalikan bapaknya kopit,-1,1,-1
3649,keren nih artha graha nyediain vaksin bantu pemerintah lawan covid,1,1,1
3650,ngeyakinin ortu buat vaksin tu bener bikin esmosi berhasil ngeyakinin bapak ibuku mental dikampung bener hoaxnya kuat banget,1,1,1
3651,lembaga meminta pegawainya masuk kantor ketika yang terkonfirmasi positif covid lembaga membantu biaya tes swab pegawainya sigh,1,-1,1
3652,moots maaf ya ga jbjb duluu soalnya ku sakit bantu doa nya ya mootsku covid huhu udah isoman,-1,-1,-1
3653,pas satgas covid cuti pas kasus naik kasian manager akoh handle sendiri beberapa yg bantu jauh,-1,-1,-1
3654,trs ibu psikolog nya cerita bokap soal keadaan gw tahun kemaren ditawarin dibeliin ipad ga awalnya ya nanyanya beli tgl kemaren baru sampe indo corona jadi ipad membantu bgt ayo renjun healing bareng,1,1,1
3655,tabe bantu kan tgl juni sy vaksin pertama pas dan kartu vaksin nya tgl juli lg tp barusan sms dr klo sy sruh dtg vaksin tgl juli jd datangma die percepat ya,-1,1,-1
3656,ya allah istri abang sepupuku positif covid moots ku bantu doakan semoga cepat sembuh ya semoga dan semua diberi perlindungan musibah aamiin,1,1,1
3657,sahabat gue tk baru aja kehilangan bapak ibunya pagi karena covid gue nangis bingung gabisa sana gabisa nemenin gabisa bantu apaapa ya allah,-1,-1,-1
3658,saya katakan tegas dalam penanganan pandemi covid india berhasil dibanding itu membuktikan indonesia kalah cerdas orang indonesia pintar berimajinasi pintar berdiskusi saatnya eksekusizonk,1,-1,1
3659,jenis vaksin dibedain yg gratis bayar dijalankan berbarengan alasannya untuk mempercepat vaksinasi pake alasan keadilan kesetaraan yang gak gratis yg bantu bayar sering pake pas perlu kok gak dipake,-1,1,-1
3660,rm pkp dilanjutkan berkuat kuasa jun jun untuk memerangi pandemik covid membantu fasiliti kesihatan sms,-1,1,1
3661,bingung yg bilang bersyukur pemerintah membantu menyediakan rs vaksin gratis dll maap nih bayar bpjs bulan bertahun tahun baru kemarin kepake rawat inap jadi hak bukan bantuan pemerintah,-1,1,-1
3662,hope pkp minggu tok berhasil kurang covid kat sarawak tok,-1,-1,1
3663,kasus aktif covid ribu alhamdulillah kembali bawah ribu seminggu kemarin di atas ribu vaksinasi juta penelitian vaksin nusantara semoga berhasil manjur dapat digunakan semangat,1,1,1
3664,hari daerah rmh da yg mninggal dmakamkn dg protokol covidstlah dmasukin liang lahat warga gda yg bntu menguruk tanahnyasmp nyari org gda yg mw nyuruh tukang gw yg kerja buset deh org katanya ga prcya covid tp giliran yg mati gda yg mo bantu,-1,-1,-1
3665,saudaraku covid bulan dikucilkan beruntung ibu muda berani baik hati bantu beri makanan minuman alhamdulillah saudaraku ibu muda bantu tak terpapar tetangga mengucilkan wafat terkena covid,-1,1,-1
3666,bebal jadi pemimpin urat malu kau putus ya jae kibarkan bendera putih ayo terima bantuan yg diberikan negara maju yg berhasil menangani pandemi covid,-1,1,-1
3667,semenjak corona suka ngerasa aku kaya jadi orang ngga berguna ya males belajarbakat dulu bagus pelanpelan ilangdulu hal dibanggain udah gaada,-1,1,-1
3668,memanipulasi menaikan angka korban covid awal pandemi berhasil meneror orang mau divaksin memanipulasi menyembunyikan angka korban akibat vaksin penipuan yg mengancam nyawa orang,-1,-1,-1
3669,bantu pasien covid tempat parkir kontainer disulap jd ruang rsud dr soetomo,1,-1,1
3670,yeay voucher flight gue berhasil extended ayo corona cepet pergi biar ku pake voucher nya,1,-1,1
3671,nganggur pahala negara smakin maju tknologi smakin canggih pradaban manusia smakin modern ini hnya turaturu dirumah aja mendapatkan pahala telah membantu pemerintah masyarakat yuk covid doa ikhtiar,1,1,1
3672,gais temen ku kena covid mau bantu kasih makanan vitamin gitu biar cepet sembuh engga tau beli apaada yg bantu aku,-1,1,1
3673,saran untuk adik mahasiswa yuk bantu pemerintah menangani wabah covid tunjukan kalian betmanfaat negeri,1,-1,1
3674,vaksin aja dandan sih biar agak lupa ga tegang karna nyatanya suara conan gray doang ga membantu vaksin pertama,-1,-1,-1
3675,sedih dalam seminggu berita duka kehilangan guru pengajar sekolah fkg dosen baik hati bantu banget selama di kampus covid jahat banget sih,-1,-1,-1
3676,tidak jumatan salah satu bentuk ikhtiar membantu pemerintah melawan covid anonim,1,1,1
3677,ts menerangkan secara terperinci kepentingan vaksin kpd masayakat luar bandar drp mendengar cerita org adanya bas bergerak dpt juga membantu untuk mencapai setidak tdknya rakyat sia mendapat vaccine cc,1,1,1
3678,merasa bebas covid gimana nya orang hajatan pake rame dangdutan ugh ganggu dgn suara keras eh bantu penyebaran,-1,-1,-1
3679,bingung makan warung mana pilih paling sepi aja antara ramai potensi penularan covid kecil hitung bantu omzet warung sepi,-1,-1,-1
3680,patroli dialogis polsek singkep barat bantu puskesmas raya kawal limbah vaksin covid menuju rsud dabo,-1,-1,-1
3681,corona berhasil menyatukan pasangan terpisah taun liang berdampingan,-1,-1,1
3682,gue ngantuk berat kepikiran kudu tidur guee soalnya abis bantu bantu hari saudara abis ketemu saudara gejalanya kek covid istirahat akuu semoga besok dapet kabar baikk aminn night gems,-1,1,1
3683,ppkm darurat katanya kalo bepergian jarak jauh pake kendaraan pribadi sertifikat vaksin terus misal penumpang yg vaksin dibawah tahun gimanaa yaa kali aja ada yang bisa bantu jawab terima kasii,-1,-1,-1
3684,kebijakan lockdown akhir pekan bpn dpt membantu pencegahan covid,1,1,1
3685,berusaha menjegal vaksin nusantara ada kemungkinan berhasil sudah penelitian gagal ngapain capecape menjegalnya biarin toh gagal,-1,-1,-1
3686,izin melaporkan hari kita berhasil mencapai angka vaksinasi semoga depannya lebih lancar,1,1,1
3687,ndak membayangkan belum kena covid diolokolok yang berhasil sembuh covid amit amit sampai ya,-1,-1,-1
3688,bantu vaksin bgt banget ada pembekalan internship yg gabisa ditinggal,-1,1,1
3689,tau nggak jenis vaksin paling ngga berguna melawan covid benar vaksin polio,-1,1,-1
3690,laju peningkatan positif covid harian melambat ppkm dipandang ngga berhasil bisa mengurangi penularan jadi misal besok klaim gerakan hari rumah berperan penting penurunan laju penularan covid klaim itu perlu diragukan deh,-1,1,-1
3691,selamat ulang tahun ke pak semoga bapak bantu negara segera bebas pandemi covid agar semua kembali sehat lancar mencari nafkah keluarga negara makmur sejahtera,1,1,1
3692,nonese nta bantu baza tukikorera ikimina nubundi ko ubukwe tuzabukora nyuma ya corona muze tujye gukoresha numvise ngo abatangiye kwizigama batangiye kugurizanya,-1,-1,-1
3693,manusia tidak membantu untuk mendapatkan vaksin jawabanya menyesatkan dunia apa sekarang,-1,1,-1
3694,yg mninggal covid kbanyakan usia produktif brarti ledakan anak yatim piatu mari saudara siap membantu mreka alloh meridhoi aamiin yra,1,1,1
3695,min minta tolong share barangkali followersnya bantu dibutuhkan pendonor plasma darah untuk bapa rustandi dgn syarat diutamakan laki usia th pernah terkonfirmasi positif covid dinyatakan sembuh,1,-1,1
3696,selamat hari minggu ibadah minggu kedepannya via zoom meeting mengikuti anjuran pemerintah untuk membantu mengurangi penyebaran covid tetap setia iman dan tuhan memberkati semua,1,1,1
3697,katanya kasus sembuh covid knapa yg udh sembuh gak edukasi bwt bantu dgn mendonorkan plasma konvalesennya krn aturan syarat trtentu,-1,-1,-1
3698,tega keterlauan tokoh negeri mahasiswa malah gencar melakukan monuver politik bukanya ikut membantu mengatasi pandemi covid dan agar tidak terpuruk ekonominya kuncinya kepatuhan masyarakat protokol kesehatan covid,-1,1,-1
3699,hindari corona tetap hidup tak berguna ak bgt,-1,-1,-1
3700,kapan usaha ortu gue covid lancar trus tiba covid mulai kurang sampe berhasil bertahan sedikit bangkit sampe covid jenis baru dan titik ya gitu mandek su asu,-1,-1,-1
3701,hari dapet berita kurang enak didengar circle terdekat untuk percaya vaksin membantu mengurangi penyebaran ayo vaksin untuk ga percaya covid silahkan imani yang percaya jangan memaksa orang untuk percaya,1,1,1
3702,kalo di vaksin bisa kena covid berarti tujuan untuk menurun angka covid ga terus guna nya vaksin cuma biar kalo sakit ga parah aja gitu berarti berguna menyembuhkan bumi covid,-1,-1,-1
3703,ini tugas saling membantu menguatkan indonesia kembali pulih sahabat doa terbaikmu untuk indonesia share yuk kuatkan doa ikhtiarmu untuk melawan covid,1,1,1
3704,akun telur tuh kebanyakan pake testimoni yg dikirim orang justifikasinya pake jurnal penelitian coba deh testimoni yg dishare telur dijadikan sampel jg dlm penelitian dibandungkan kasus vaksinasi yg berhasil krn yg berhasil jg ga dikit,-1,-1,1
3705,mereka ikut membantu tidak ringan bisa dihitung misalnya vaksin jumlahnya nakesnya vaksinatornya butuh gitu loh,-1,-1,1
3706,gelombang kedua covid lha emang yg pertama udah berhasil ditekandiatasi ya,-1,1,1
3707,tentang lagi rame dibahas membantu banget percepatan vaksin untuk lansia sehatsehat yaa semuanyaa,1,1,1
3708,ditawarin vaksin masih punya keberanian besar untuk menerimanya tolong bantu yakinin,1,-1,1
3709,stay safe kalian santai kalem panik panik sumber segala penyakit tetap hidup tidak berguna,-1,1,-1
3710,vaksin rollout coming soon tindakan tegas kat majikan kedai tak patuh sop tentera diberi kuasa untuk bantu polis tangani isu pati tu ja kot sempat tangkap nilain tu dah dengar,-1,-1,-1
3711,bismillah halo mas doni salmanan covid sekarang lagi ppkm ga ngamen nih mas ga bayar cicilan bulan nih mas bantu dong thank,1,-1,1
3712,selamat untuk negara thailand yg berhasil mendidik sejumlah anjing terlatih jenis labrador retriever untuk melacak mendeteksi org yg dinilai positif negatif virus covid sebuah kemajuan dunia medis internasional,1,1,1
3713,pak menteri minta rakyat bantu sumbang dana untuk beli vitamin obat obatan covid bapak dpr minta usul untuk dibikinin rs darurat khusus pejabat,1,-1,1
3714,mohon perhatian bapak presiden wna tinggal daerah bisa jakarta pulang luar negeri kereta api pesawat belum selesai vaksinasi mohon membantu mengatasi masalah terima kasih,1,1,1
3715,moga vaksin sinovac kmrn berguna jd tameng yg gak pucet ngondoy pas ketemu corona yakin kalo sinovac kuat ky warga indonesia,1,1,1
3716,oknum pejabat yg gk dukung percepatan penanganan covid gak layak didengarkan partai jg gitu nyinyir solusi patut ditenggelamkan kalau darurat aja gak berguna saat tenang yakinlah karo inyong,-1,-1,-1
3717,emang sih periodenya terbatas stok terbatas tolonglah covid naik pandemi usai ayo bantu pihak mekdi harus tanggung jawab atas situasi hari ini,-1,-1,1
3718,udah terbiasa disuntik jarum donor darah pas jarum suntik yg vaksin jadi ga berasa vaksinasi sinopharm berhasil,-1,1,-1
3719,bayangin keluarga sekarat bahkan meninggal gak yg kamu lakuin membantu kamu tapi gakan segitu bikin putus asanya covid,-1,1,-1
3720,kegiatan bertujuan membantu masyarakat membutuhkan saat pandemi covid respon masyarakat berdasarkan pengalaman tahun sangat baik merasa terbantu,1,1,1
3721,wokeh berhasil survive sampe hari memang dampot covid,1,1,1
3722,ternyata masker berguna mencegah penularan covid juga bikin org jd kelihatan lbh ganteng,1,1,1
3723,pkp jelas berkesan semalam kes hari berapa berkesan dua minggu semangat ebit lew membantu rakyat patuh sop rakyat bersatu covid menjatuhayuhh,1,1,1
3724,jog yg udah vaksin bekas suntikan punya vaksin tgl kmrn sampe skrg nyeri kalo dipegang bakal sembuh thx yg udh bantu jawab,1,-1,-1
3725,actually golongan antivax membantu memendekkan barisan utk beratur bg mendptkan vaksin covid,1,1,1
3726,menteri jokowi kepala lembaga bawah presiden dari yang tampil publik sekitar orangan sisanya kemana ppkm ngumpet takut direshuffle ayo keluar bantuin negara bantu presiden lawan covid ayo naikin solidaritas kemanusiaanmu,-1,-1,-1
3727,vaksinasi berhasil bakalan elit parpol yg gasuka pastinya,1,-1,1
3728,lingkaran covid dekat kita mantemen ga keperluan keluar rumah mending dirumah aja yg punya privilege wfh gunain waktu sebaik banyak loh yg di posisi termasuk gw anyway bantu doa untuk mas gw ya yg isoman dirumahnya thx,1,1,1
3729,kekonsistenan pemrintah dlm melakukn testing jga krja keras berbagai pihak berhasil menurunkan angka kasus positiv covid jawa timur,1,1,1
3730,tementemen yg ngirim makanan banyak bantu pas covid kemarin skrg yg positif ada keluarganya yg positif ku bales kebaikan yg kemarin udah peduli ngirim balik statusku yg punya pekerjaan tetap bikin sad,1,1,1
3731,ada temen deket saudara kena covid ngga berani tanya khawatir khawatir tp nggabisa bantu selain kirim makanan,-1,-1,-1
3732,ayo pakbuk pemerintah kalo bikin kebijakan aturan yaa emang outputnya terasa nyata rakyat yang pastinya jelas berguna kebijakannya awal covid pada guyon masa bikin kebijakan outputnya guyon,1,-1,1
3733,pelibatan berbagai komunitas dapat membantu menurunkan angka penyebaran covid jawa timur langkah sesuai tujuan diberlakukannya ppkm gubernur jatim,1,1,1
3734,ampe negara berhasil membuat warganya terpecah percaya covid yang ngga,-1,-1,1
3735,untuk memudahkan jangkauannya khofifah mengimbau kepda asn kabupaten kota untuk membantu percepatan penyelenggaraan vaksinasi,1,1,1
3736,prokes mencegah virus masuk dalam tubuh vaksin bantu tubuh melawan virus yg sdh masuk berat penyakit tergantung jumlah virus yg masuk daya tahan tubuh kuat selamat virus kuatkita wafat lbh baik cegah virus masukdrpd melawannya sudah masuk,-1,-1,1
3737,indonesia darurat covid presidenmu jajarannya bekerja keras mengatasi lonjakan covid mestinya bantu negara mengatasi,1,-1,1
3738,ada aja berita duka seliweran soal orang yg divaksin kena covid berat ngomong vaksin berguna ya mestinya ngomong divaksin aja berakhir itu kalau nirvaksin waspadalah waspadalah,-1,-1,-1
3739,bangga banget aqua membantu percepatan vaksinasi lansia caranya cukup canggih anti ribet tinggal liat aja,1,1,1
3740,tips akan vaksin az usahakan jadwal vaksinnya hari jumat ketika bereaksi mengganggu pekerjaan keesokan harinya semoga membantu,1,1,1
3741,dah terbukti darurat membantu rakyat nahas covid jadi mengaku kalah buka parlimen di situ penawar jalan keluar islam bermesyuwarah tu satu step menyelesaikan masalah,1,-1,-1
3742,hrus dukung membantu dgn dukungan moral mental spiritual finansial yg dibutuhkan masyaralkat yg terkena musibah covid tegas irwan,1,1,1
3743,tenaga medis guru sudah vaksin dahulu kalo pada takut covid apa anggaran vaksin kalo nyatanya ga membantu,-1,-1,-1
3744,tidur membantu sistem kekebalan untuk melawan virus corona,-1,1,-1
3745,soal pencitraan beliau mengajarkan saatnya kita harus meningkatkan semangat gotong royong bahu membahu membantu salah satu cara menguatkan perekonomian tengah hempasan pandemi covid ambil sisi baiknya,1,1,1
3746,kcg nanya biaya steril kucing betina berapaan ya terus kalo dinas peternakan gak sih menyediakan vaksin kucing steril dll dom samarinda makasih utk yg bantu jawab,-1,-1,-1
3747,pnj peduli bakmi bantuan pandemi halo kawan pnj bakmi bantuan pandemi sebuah agenda untuk membantu mahasiswa mahasiswi pnj sedang terdampak terpapar covid pendataan bakmi mahasiswa mahasiswi,-1,1,1
3748,stimulus listrik bulan maret siapkan untuk menyalurkannya kami menyadari stimulus listrik sangat membantu meringankan beban kelompok masyarakat mampu rentan menghadapi pandemi covid,1,1,1
3749,fun fact semenit vaksin ngelus lengan bisikbisik yg baik ya bikin kenapakenapa ya kuat ya bismillah ya demam ya tp seriously percaya gak sugesti afirmasi positif cukup membantu ternyata hahahahahha,1,1,1
3750,sedih liat cerita teman makin yg positif kebayang ps awal covid serumah positif itu harihari tersuram hidup kami kita sakit keluarga jauh bisa tlfn nangis krn pengen dateng bantu rawat anak tp tolak,-1,-1,-1
3751,kecilnya dihadapan allah takdirnya pagi keluarga berduka ditinggalkan paman abang kandung ibu berhasil berjuang melawan covid takdir berkata paman malah berpulang setelah hasil tes negatif,-1,-1,-1
3752,serius nanya tau vaksin kedua trus besoknya langsung penerbangan boleh engga ya makasih mau bantu jawab,-1,1,1
3753,umat islam berkesempatan ikut haji tolong bantu semoga mengatasi pandemi covid amin,1,1,1
3754,yang kamu lakukan dinyatakan positif covid bantu jawab,1,-1,1
3755,hari menelfon kawan saudara yg kena covid untuk supposemangat penyintas merasa kehadiran teman saudara membantu membangkitkan mental pemulihan saat menjalani isolasi,-1,1,-1
3756,kata pendengar gua gak bakal prioritas vaksin hidupnya gak berguna kayanya tidak berlaku bang untuk orang hidup suatu pulau mengandalkan pariwisata baru beraniin untuk tweet udah vaksin dua bulan,-1,-1,-1
3757,gasabar berita indonesia penuh indonesia berhasil nuntasin covid masker udah gaperlu dipake waktu wisata sekolah dll buka kaya sm ekonomi pulih,1,-1,1
3758,bismillah vaksin kedua semoga berhasil amin,1,1,1
3759,jahe merah ampuh melegakan tenggorokan sistem pernapasan kandungan dlm jahe merah diklaim ampuh membantu memperkuat sistem kekebalan tubuh herbal satu memiliki kandungan senyawa aktif gingerol bisa mencegah virus corona,1,1,1
3760,simpelnya aja sih gk suka kebijakan presiden menerima bantuan apapun covid beliau jajaran pemerintah hutang untuk bantu rakyatnya termasuk bantuan loh tidak melewati tol yg katanya bla bla bla cara protes yg elegan,-1,1,-1
3761,kcg steril vaksin gak ya soalnya udah keburu birahi kucing jantan kuu makasih udah bantu jawab,-1,-1,-1
3762,mendukung vaksin nusantara diinisiasi mantan menteri kesehatan terawan agus putrantosaya berharap vaksin bisa membantu pemerintah memutus penyebaran pandemi covid,1,1,1
3763,lumayan sih covid sdh membantu mengurangi populasi manusia bumi yg termusnahkan sdh tenang dialam baka yg selamat terhimpit kesulitan hidupwahai covid mohon sudi untuk berlalu secepatnya amin,1,1,1
3764,yg minta periode beralasan berhasil penanganan covid mengklaim rakyat mendukungrakyat mana,1,-1,1
3765,agak beban mental yakk lu kena covid ditolong org pas keluarga yg covid lu ga banyak bantu,-1,-1,-1
3766,baik aja sih sehat hidup berguna buat pasien udah minggu lewat vaksin cov kedua gada apa belom ya kwkwkwkw tuhan tau niatnya memebantu,1,1,1
3767,sobat mutualan mari mulai lingkungan keluarga masing ingatkan mari bantu negara melawan serangan pandemi jadikan menjadi gaya hidup pandemi usai,1,1,1
3768,keadaan apa dapat membantu dalam menangani covid bersenam,-1,1,1
3769,kekonsistenan pemerintah melakukan testing juga kerja keras berbagai pihak berhasil menurunkan angka kasus positiv covid jatim,-1,1,-1
3770,pembiayaan satgas covid didapatkan hasil judi euro mafia bantu masyarakat untuk membalik keadaan,-1,1,-1
3771,mari membantu pemerintah mengatasi mengurangi covid patuhi protokol kesehatan pakai masker keluar rumah,1,1,1
3772,pd wktnya nti pandemi berubah mjd endemi vaksinasi obatnya mungkin industri farmasi dunia berlomba menciptakan obat yg tepat yg berhasil kaya raya bisnis besar kita mesti bersabar menantikan itu,1,1,1
3773,fyi fyi aja nih indo udah dapet bantuan covid dr negara nah peran dalam membantu indo masa yg bantu dr negara tapi warganya tetep cuek,-1,1,1
3774,terimakasih terinakasih terimakasih betulbetul hebat luar berkat kerja keras tak mengenal lelah pekerjaan berhasil cacat covid benarbenar terlalu sangat terkendali sekali terimakasih ngarep kiriman sembako,1,-1,1
3775,td pagi vaksin blm efek berarti skrg semoga berhasil,1,1,1
3776,pagebluk pandemi covid merajalela semakin prihatin upaya dan terus dilakukan pemerintah untuk meredam penyebarannya akan berhasil tanpa kontribusi kita semua ayo jauhi kerumunan tetap pakai masker,-1,1,-1
3777,membantu penginputan vaksinasi rw,-1,-1,1
3778,penghasilan menurun covid udah coba cari tambahan belum berhasil yuk ikut webinar harga webinarnya jutaan okay,1,-1,1
3779,wow pak jokowi dibilang berhasil menangani covid ama politisi gerindra,1,-1,1
3780,yuk pakai dua masker mulai sekarang untuk pencegahan covid lebih optimal pemakaian masker pas wajah membantu membatasi penyebaran virus penyebab covid,-1,-1,1
3781,menunggu hari dimana semua bersorak sorai berhasil menang lawan covid,1,1,1
3782,kalo lihat keadaan bersyukur banget berhasil melewati lorong syakaratul maut covid desember,1,-1,1
3783,bukan orang terjun langsung dokter perawat para swaber bidan yg baik hati aku orang dibelakangnya yg bantu sediaain obat para penderita covid bener bener sampe itu ngerasainnya udah takut sebenernya sendiri,-1,-1,-1
3784,baru aja denger ortu jd keluarga dr kakak gw pagi meninggal penyakit plus suspect covid ortu gw bantu nyari pemakaman susah nyarinya percaya deh susah udah dapet trs bokap gw cerita kalo dimakamin aja udah kaya ngantri kasir rame bgt,-1,-1,-1
3785,hrs brp kali dikasih tau sih kalo vaksin ya berarti gak kena vaksin membantu untuk proteksi tubuh virus karena tubuh udh kenal sm virus duluan vaksin jg bantu efek virusnya bisa diminimalisir,-1,-1,-1
3786,temen temen twitterku ada tau bantu jawab yaa udah vaksin pertama pas vaksin dua ga taunya kita kena covid tetep vaksin sesuai jadwal harus nunggu bulan,-1,1,-1
3787,sebelum komentar belajar sejarah presiden dua periode bapaknya anggota dpr di bayar dari uang pajak rakyat selayaknya bantu pemerintah dlm melawan pandemi covid sebagai oposisi oposisi tidak beda,1,-1,1
3788,vaksin berbayar seyogyanya diambil nilai positifnya anggap subsidi silang membantu beban pemerintah pemilik uang dg volume berbayar volume gratis catatan supply vaksin ditambah berpolitiklah yg dewasa merongrong atmosphere,1,1,1
3789,aksi nyata bantu rakyat perangi pandemi covid corona,-1,1,1
3790,ermi mengatakan dari sangat diimbau semua masyarakat membantu peningkatan cakupan vaksinasi utamanya tingkat usia lanjut ya,1,1,1
3791,kotak amal masjid kampung ku kas masjid baitul maghfiroh untuk bantu warga yg terpapar covid baik yg dirawat rs yg isoman itu gotong royong warga bantuan pemkot semarang insyaallah,1,1,1
3792,keluar bantu pekerjaan bapake kesana kesini gang pd ditutup pas masuk disinfektan terpikir seperti nya warga nya pd covid jd parno aing skrg,-1,-1,-1
3793,lawan corona tpi masker kt beli ayo pemerintah bantu lawan corona jgn di suru beli masker terus semntara pendptn kerja tidak menentu utk biayai keluarga,-1,-1,-1
3794,viral foto petugas covid muhammadiyah membantu pemakaman umat katolik yg wafat terkena covid di medsos kalangan katolik beredar sosialisasi tpe,-1,1,-1
3795,tenaga relawan rsud cengkareng berharap insentif covid nya turunsampai bulan maret insentif covidnya juga turunsedangkan semua punya keluarga yg penuhi kebutuhannyatolong di bantu pak,1,-1,1
3796,bude gw meninggal karna covid sedih nya dobel sedih ditinggal sedih gabisa bantu apaapa,-1,-1,-1
3797,corona bikin moveon berhasil,1,-1,1
3798,berasa dikepung covid bgt tetangga kanan kiri rumah positif skrg dirumah kakak mba yg bantu setelah libur hari masuk batuk bersin gak berenti,-1,1,-1
3799,yunikorns dong bantu bikin sub aplikasi layanan vaksinasi govak misalnya aselerasi vaksinasi jadi kunci survival indonesia,1,-1,1
