,tweet,bert_predict,lstm_predict,bert_lstm_predict
2329,wuhan kontol lu nya kali kontol jangan nongkrong mulu goblok sekalinya kena awas aje lu ngerangkak minta bantu wuhan aja udah dikit banget kasus covid nya tolol,-1,-1,-1
2330,kebijakan konyol ppkm penyekatan jalan gak berguna ujung nya duit ngok,-1,-1,-1
2331,lupa blm makan malam butuh energi untuk besok membantu mengsukseskan vaksin,-1,1,-1
2332,orang pingsan gw bantu angkat cek hari ternyata positif covid anjrit,-1,-1,-1
2333,bismillah mau donor darah untuk diambil plasmanya semoga membantu orang terkena covid untuk pulih cepat,1,1,1
2334,minggu dinyatakan sembuh corona sudah juta pernah positif indonesia teruntuk perawatku si masmas pagi terus semangat si mbamba tiap siangmalem semangat selalu bantu ambil paket kiriman kuucapkan terima kasih,1,1,1
2335,memang disengaja jalan ditutup terakumulasi kerumunan dahsyat kalo dah gitu tinggal laporkan pd global warga terpapar covid bertambah secara luar emejing bantu dongutang hibah yaa keren idenya,1,1,1
2336,sebagian besar karyawan menolak divaksin banyak liat berita dampak negatif vaksin itu meninggal lainyabarusan breafing mengundang tokoh agama daerah perusahaanya bisa membantu meyakinkan karyawan untuk divaksin segi agama,1,-1,1
2337,jumat ceriatuhan semoga rejeki untuk keluargaku sedang sakit covid iniada org yg terpapartuhan bantu pulihkan dan lancarkan pengobatannya aminn,1,1,1
2338,semoga allah bantu semua perangi covid,1,1,1
2339,pak selamat ya cie berhasil mengendalikan covid tembus juta prestasi luar loch,1,1,1
2340,papa positif bantu doa ya mutualku biar ak adek dapat vaksin bisa pulang papua,1,-1,1
2341,nuduh orang endorse covid nih ngomong isi atm gua banyak nambah banyak ilangnya ya allah orang yg sempet nya mikir jahat tp ga bantu kaya gitu nggak nyawa nya dituker aja pasien yg hidupnya terancam,-1,-1,-1
2342,terima kasih tetangga yg baik banget membantu dlm isolasi mandiri dan keluarga semoga negatif covid semoga pandemic lenyap muka bumi ya allah swt tingkatkan prokes jgn sampe kendor,1,1,1
2343,kalo petisi frlikopter ga berhasil ga sih berdoa org kena covid terus meninggal,-1,-1,-1
2344,vietnam melaporkan kasus baru positif covid hari kamis menjadi rekor tertinggi pandemi covid melanda vietnam vietnam salah satu negara berhasil mengendalikan virus covid awal pandemi,-1,1,1
2345,vaksin gotong royong belinya asing berarti gotong royong bantu industri farmasi luar negeri andaikan negara mau repot keluarkan budget riset bikin vaksin mandiri produksi ma al rakyat kalau harus beli kayaknya rakyat ikhlas,1,-1,1
2346,dokter wachyudi muchsin humas idi ar yg kena covid mengabarkan kondisinya mulai membaik harus tetap menggunakan alat bantu nafas saturasi oksigennya normal semoga lekas sembuh dokter andalan,1,1,1
2347,pertama kali sejarah tidur dirumah berguna negara,-1,-1,1
2348,habis berhasil daftarin vaksin ortu semoga lancar sampe hari,1,1,1
2349,btw barusan ditelfon pmi lolos jadi pedonor plasma convalescent covid puji tuhan yah seenggaknya hidup berguna orang,1,-1,1
2350,vaksin tentu bebas covid trus harus vaksin kandungan vaksin kita tau ya bantu kasi jawaban maaf awam,-1,-1,-1
2351,emang dulu orang ga percaya vaksin copid manjur seiring membaca artikel copid jadi pingin divaksin alhasil berguna buat masa yang panas panasnya nunggu antrian vaksin,1,-1,1
2352,bagaimanapun penanganan hilir akan berhasil secara maksimal hulunya ditangani secara cermat vaksinasi yang dilakukan untuk meningkatkan kekebalan kata gubernur jatim,1,-1,1
2353,vaksin membantu untuk membangun perlindungan dalam tubuh disitulah peran dettol untuk membantu perlindungan luar tubuh,1,1,1
2354,dimusim pandemi covid yg parah inisaran gu jgn bacotjgn yg bebal melanggar prokes mjgn penguasa yg membiarkan manusia berkumpuljgn pelit bantu mrk selalu dirmh dng berikan allowance utk hidup sehari jgn kami panik,-1,-1,-1
2355,kerja kerja kerja covid kerja nonstop haricuma dapet libur harihabis langsung lanjut dikirim dinkes prov bandung bantu penanganan covid bandung sama allah suruh istirahat,-1,1,-1
2356,nonton berita metrotv muncul bpk wapres dgn menghimbau ulama utk membantu mengatasi pandemi covid bpk wapres sdh terlambat krn awal bpk tdk menghimbau utk jgn provokasi rakyat jgn menebar kebencian taat prokes dr pemerintah,1,1,1
2357,kabar temen semalam kehilangan ibu sedang berjuang bapaknya kabar temen berhasil sembuh covid pulang dr rs pandemi bikin emosi kyk bubur diaduk trus digoreng,-1,1,-1
2358,temen minta bantuannya temen tau obat untuk covid ya paracetamol dll bantu jawab ya btw buat tugas temenku nyari tau obat utk covid ya terimakasih,1,-1,1
2359,memang vaksinasi meningkatkan mutasi virus tetap yakinlah natural immunity imun alami tubuh yang ciptaan tuhan mencari jalan keluarnya cro immunity imun silang saling membantu menguatkan tubuh satu lain,1,-1,1
2360,kakak gw nganter bokap nyokap untuk vaksin kedua kali sedih tempat vaksin lansia sepi gratis tolonglah teman bantu percepat vaksin lansia yang gak lansia lebih cepat dapetnya,-1,1,-1
2361,semua penerima vaksin tahniah terima kasih sikit sikit bantu untuk bendung masalah,1,1,1
2362,harus panic buying susu bermoney yuci imun bagus mah cukup ga kelaperan tidur cukup ga stre minum galon susu sm yuci hari kalo kelaperan kurang tidur stre ga bantu kalo ttp kena covid jadi stre stop panic parno,-1,-1,1
2363,corona benarbenar berhasil melemahkan tubuh,-1,1,-1
2364,yuk bantu doa yuk covid cepat kelar,1,1,1
2365,hikmah covid aku nampak dulunya kasar jadi lembutempati ego bertimbang rasa kedekut pemurah kurang membantu ketagih untuk bantu bodoh berilmu suka hal sekarang bpasukan,-1,-1,1
2366,kerjaan yg lo bilang ngawangngawang kerjaan yg berhasil mengamankan stok vaksin dalam negeri masyarakat hehehehe,1,-1,-1
2367,pak jemaah haji indonesia tdk masuk saudiapa perlu dana akan bantumakanya covid terus di bahas pak biar tdk kenak lockkalah banglades indonesia di lock pemerintah saudi,-1,-1,-1
2368,kowe po ra pingin krungu kabarku berhasil nglawan covid po ora wis taboki uwong opo durung mati opo durung,-1,-1,-1
2369,pakaian astronot jelas gak mudah syarat membantu penanganan wabah covid energi dikeluarkan banyak belom ngapangapain karena rada pengap,-1,1,-1
2370,baca sinitnyt msh suangat buanyakk orng yg gak paham gmn pandemiknapa sih hrs maskeranknapa sih hrs jaga jarakharus vaksinsedih lohyuk yg paham bantu share soal dgn baikjgn sebar hoax,-1,-1,-1
2371,kan ujungnya jelas gaes krn gag efektif vaksin kalo gag berhasil salahin vaksinnya,-1,-1,-1
2372,usahakan ya untuk memakai masker setidaknya jaga jarak ngobrol dgn rekankolegakita pernah tau saja bertemu dgn otg covidorg gejala benar membantu sih,1,1,1
2373,efek samping vaksin sinovac muncul nggak beneran nanya pls bantu jawab,-1,-1,-1
2374,muak pas wa waktu oleh dokter acara kak eci donor darah gak mentang gue udah jadi penyintas covid enak lu gue survive sendirian ambon terus gue berhasil sembuh kalian mengharapkan gue berbagi kebaikan hati kalian,-1,-1,1
2375,postmortem pusat vaksin frim kelebihan tempat tenang dikelilingi pokok staf kesihatan banyak membantu giliran menunggu tidak ketepatan masa terbaik,1,1,1
2376,tujuan rencana ppkm menyusutnya kasus covid rencananya berhasil semoga kedepannya tujuan rencananya berhasil ya saat ini tidak,-1,-1,1
2377,vaksin covid tak berguna dgn obat cacingan tekor mandar obat murah,-1,1,-1
2378,purworejo yayasan sosial yg bantu dana makanan untuk pasien covid yg isolasi mandiri gak yakarna pemasukan isolasi cc,1,1,-1
2379,dikasi pencerahan dibujuk berkali smpe ibu marah kakak berhasil ngebujuk adik bwt ikut vaksin,-1,-1,-1
2380,ngoni mah enak covid naik naiknya dpe kasus ngoni bole pi acara bersenang senang tida pake maskerbekeng konten kabar nakes apd pasien yg krg tertolong dengan alat alat bantu nafas miris sih,-1,1,-1
2381,aq pikir ternyata enak jg jd alumni covid bbrp hari yg aq rawat kk yg lg isoman sekeluarga aq bantu cari kebutuhannya kita ngobrol dlm satu ruangan prokes utk menjaga psikologis krn kk punya penyakit mudah gelisah,1,1,1
2382,bismillahvaksin yg kedua yu sehatkuatsemangatkita klo jaga bantu semangat,1,1,1
2383,yg bilang din temen lu ada yg kena covid ko lu ga bantu mon maap temen ku kebetulan kena saling kenal satu aama wkwk kalo gua bantu yg satu ga bantu satunya ga enakk ditambah tetangga dan sodara pada kenaa trus yg,-1,-1,-1
2384,gak sih buka donasi bapakbapak bantu proses pemakaman jenazah pasien covid,-1,-1,-1
2385,apresiasi perlu ditanamkan selamatkan umkm berhasil bangkit melalui masamasa sulit pandemi covid,1,-1,1
2386,dinas terkait yg bertugas untk membantu pendataan dn identifikasi prioritas vaksinasi selanjutnya dispendukcapil mpe dngn camat kepala desa babinsa dn babinkamtibmas,1,1,1
2387,pak minta tolong warga sediakan oxymeter thermogun bantu beliin makanan apapun termasuk siapkan mobil untuk angkut kondisi darurat ngandelin ambulans juga crowded pesan bidan satgas covid kami,-1,-1,-1
2388,si bodo ya orang orang ga percaya covid bisa ga si tolong bantu jaga prokes pake masker susahnya,-1,-1,-1
2389,gt untuk membantu penanganan covid yuk pahami apa sih dimaksud tracing pelacakan kontak covid,-1,1,1
2390,alfatihah bt dr ali nurhasanperjuangan mu mlwn covid membantu manusia amt dihargaimoga amalan mu diterima diredai dirahmati allahhaamiin,1,1,1
2391,suntik vaksin jadi anak berguna untuk keluarga gak,-1,-1,1
2392,ironis negara berkembang yg menangani covid yaa semoga ppkm bisa saling membantu menguatkan lain,-1,1,-1
2393,pas nenek kakek gue dr bunda kena covid itu gc bgt atasin rawat nya jd alhamdulillah sembuh nenek gue smpe bertanya knp berhasil sembuh kyk msh gapercaya gt sad mrk kena krn tante gue yg serumah sempet kerumah sakit untuk cek tht jd terpapar,1,-1,-1
2394,mafia alkes licin dibelakang oknum pejabat negata pak mohon bantu di kota cirebon alat kesehatan terbatas orang saja bisa swep anti body antigen rakyat dibawah rata ada layanan termasuk vaksin merata,-1,-1,-1
2395,hari ruang icu covid gue bertanyatanya diri gue gue udah maksimal belomnya bantu memenuhi kebutuhan esensial gue kadang suka kesel pasien tapi tangan kaki dua gue suka ga tega kalo ga buruburu nyamperin ketika,-1,-1,-1
2396,retweet berita vaksinasi indonesia yg dicapai tahun mendingan bantu pemerintah yg bodoh dengan stay dirumah tidak keluar rumah tidak urgent trims,-1,-1,-1
2397,relawan muhaimin iskandar menebar solidaritas sosial bantu menguatkan tengah sulitnya masyarakat menghadapi berbagai dampak covid salam relawan deklator dede slamet naskah deklarasi diserahkan kpd mahendra perdana utk disampaikan kpd muhaimin iskandar,1,1,1
2398,dunia gak percaya negeri wakanda lemahkan virus covid dibuat vaksin negeri wakanda baru berhasil melemahkan kpk untuk dibuat fuck sin bansos,-1,-1,-1
2399,perbedaan situasi situasi mudik tahun terakhir berbeda mudik menjadi euforia masyarakat kekhawatiran covid berhasil menahan keinginan masyarakat untk mudik masyarakat mulai ngeyel merasa aman tengah vaksinasi,1,1,1
2400,efek vaksin membantu utk tidur cepat,1,1,1
2401,perlu ppkm asal petugas benar benar tegas tak kenal lelah bertugas ppkm percuma malah orang kayak yg kecekik kuncinya aparat tindak tegas orang melanggar akan berhasil menanggulangi covid,1,-1,1
2402,bem ui ketimbang bikin gaduh skrng mending jadi relawan covid aza biar kelihatan berguna negara kritiknya dilanjutkan tar hbs covid aza,1,-1,1
2403,jumlah kasus covid jakarta bertambah perlu mempertimbangkan pentingnya kualitas udara ruangan penyebaran virus itu membuat indeks resiko virus panduan untuk membantu menjaga keamanan udara ruangan penasaran,-1,-1,-1
2404,covid melanda negara eropapara pemimpinnya serius bekerja berhasil keluar wabah lha pemimpin malah jadi kesempatan ngegarong duit pensiun akhirnya ya ky skrg,-1,-1,-1
2405,negara ini masyarakatnya berketuhanan memanjatkan doa tapi pemimpinnya mengajak untuk mengheningkan cipta yg jelas ga manfaatnya baik waktunya dipakai membantu nakes pasien covid yg jelas membutuhkan pertolongan,-1,-1,1
2406,ayo bantu rakyatringankan beban biaya listrik dibantupom bensin dikurangi jam operasionalnyaatau diperketat membeli bbm tunjukan tanda sdh vaksin,1,-1,1
2407,selamat tidur mbak berharap sebisa bantu doa semangat aja ada kabar negatif covid dari desy,-1,1,-1
2408,khawatirkan naiknya angka covid ini mereka di melakukan amandemen untuk melanggengkan kekuasaannya ingat lahir covid hangat bisa bantu kekhawatiran saya tidak terjadi,-1,-1,-1
2409,ini tetap jadi pahlawan kebaikan beragam kemudahan siapkan untuk kamu berpartisipasi membantu pejuang garda terdepan tenaga kesehatan yang kini tengah berjuang untuk melawan covid,1,1,1
2410,halo mutualan ku jarang intrak aku titip doa ya mama ku positif covid mama butuh ruang icu semoga di permudah ya doa kalian sangat membantu,1,1,1
2411,yuk akun telur kalo kasih contoh luar negeri eropa mereka kasus covid meninggal jumlahnya banyak indo kasih contoh ya yang negara berhasil gitu lo kayak singapura,1,-1,-1
2412,tak membantu yang terkena wabah covid minimal membebani orang katakata yang pegang ketika bertanya kabarmu alhamdulillah aku baikbaik dan sehat wes cukup,1,1,1
2413,india mengklaim berhasil menahan penyebaran infeksi virus corona mana sejumlah distrik melaporkan nol kasus baru sepekan itu kampanye vaksinasi covid india menjangkau juta orang,-1,-1,-1
2414,senin kemaren sempet ruang icu covid liat langsung gimana sakitnya pasien gimana capeknya nakes yg langsung terjun pasien covid kasian bgt nangis kalo bantuin tak bantu sayangnya cuma ngasih obat,-1,-1,-1
2415,keluarga yg ga vaksin marketing mencoba mengedukasi bernegosiasi utk vaksin allhamdulillah akhirnya berhasil mau di vaksin sampe skrg berhasil bernegosiasi diri supaya mau utk divaksin,1,-1,1
2416,ribut temen india yg gue ceritain awalnya ributin soal vaksin sih malah nyalahin barat gak dibantu bilang india udah bantu negara soal vaksin giliran malah gak dibantuin balik,-1,-1,-1
2417,desember libur semester tiba satu anggota keluarga besarku positif covid akhir tahun saudara mama positif gejala berhasil sembuh dlm waktu hari minggu giliran saudara papa yg menderita kanker yg positif,1,1,-1
2418,harapan adalah fasilitas kesehatan bertambah kewalahannya dlm membantu menangani pasien yg terkena covid mereka fokus bisa maksimal menjaga sendirinya,1,1,1
2419,mengira sistem imun baik kunci kena covid sayangnya nggak benar sesehat apapun tubuhmu nggak melawan yang pernah kenali sistem imun yang baik membantu taraf kamu sembuh aja,-1,1,-1
2420,yg covid blok sebelah ada yg japri ngajak bikin jadwal kirim makanan tp yg diminta bikin grup koordinir orang orang yg baik mau bantu banyak tpi ga bisa jadi jembatan sungkan memulai mengajak,1,-1,-1
2421,satu soalan terfikir kalau orang dah positif covid terus cucuk vaksin membantu,-1,1,1
2422,tetangga isoman serumah segercep lgs urunan bantu makan mrk mingguan tp ya beruntung sih daerah ay ga covid spike kalo households kena berabe jg,1,-1,-1
2423,corona usai ga nyicil pun uang beli ga ada uang ga usah beli daripada kelimpungan tengah jalan begini berhasil nahan gua untuk nyicil motor untung pario mayan cakep mesinnya ga rewel,1,-1,-1
2424,mahfud berdialog tokoh agama ulama kiai tokoh masyarakat lokal meminta turut membantu pemerintah menyadarkan masyarakat bahaya covid,-1,1,-1
2425,ikut seneng liat tementemen yg menjadi penyintas covid berhasil survive pagi dapat berita sodara terdekat gagal utk survive kembali rumah bapa surga stay safe tmentemen yg sehat,1,1,1
2426,vaksin tiba pekanbaru bantu warga pekanbaru kecamatan,1,-1,1
2427,ditengah melonjaknya penderita covid yuk sama share berita yg berhasil sembuh menumbuhkan semangat,1,1,1
2428,tahun menyaring pertemanan percaya corona alhamdulillah berhasil tahun ujian baru menyaring pertemanan percaya vaksin spaneng pala tau temen dapet jatah vaksin gak diambil krn takut,-1,-1,-1
2429,skrining diikuti vaksinasi membantu mengurangi kejadian kanker serviks secara efektif,1,1,1
2430,untuk memudahkan jangkauannya khofifah jg mengimbau kepda asn kabupaten kota untuk membantu percepatan penyelenggaraan vaksinasi,1,1,1
2431,coba deh ribut ribut mulu soal covid mending cari tau orang disekitar lo lagi kesusahan bantu mengurangi bebannya sebisa lo aja,-1,-1,-1
2432,alhamdulillah besok jatah vaksin sinovac gratis membantu pemerintah menyelesaikan pandemi aamiin,1,1,1
2433,infeksi covid amerika serikat berhasil merosot menyebabkan dow jones dibuka naik poin,-1,-1,-1
2434,mrie yg bantu bikin puisi covid,1,1,1
2435,kemaren liat tweet brunei berhasil ngatasi covid eh pagi udah gorengannya wag njir cepet banget,1,-1,1
2436,plis bantu kalo ke jogja pake kendaraan pribadi wajib bawa surat bebas covid ga plis plis plis dari jawa barat soale terima kasih ugmfe,1,1,1
2437,stop komen buruk covid aib tsay bantu doain aja ya semoga tetap diberi kekuatan sembuh tambah bikin pikiran semangat,1,1,1
2438,alangkah bijaknya kita menjadikan pandemi bahan eksistensi dengan memposting berita hasil swab cerita vaksin berita kematian tidak membantu sebaliknya menambah kepanikan membuat keadaan tidak baikbaik,-1,-1,-1
2439,min keknya sma tau deh kalo kasih jarak dipenumpang duduk ga bantu upaya pencegahan covid krna yg berdiri literally kayak molekul benda padat rapet banget,-1,-1,-1
2440,gubernur banten mengaku pemprov banten belum berhasil menekan ledakan kasus covid wilayahnyadi provinsi termiskin pulau jawa kota tangerang menjadi penyumbang terbesar jumlah kasus covid bekas wilayah jawa barat,-1,1,-1
2441,penerintah jokowi penanganan pandemi covid berhasil efektif maksimal berkenan ganti menkes budi sadikin profesi dokter luhut binsar panjaitan lbp jenderal menkes punya target waktu tangani pandemi covid lbp omong besar,1,1,1
2442,kunci melawan covid stop penyebaran nya lockdown vaksinasi sembuh yg sakit ayo bantu,1,-1,1
2443,pegel karna vaksin dapet bantu pindahan rumah kenceng banget rasanya,1,1,1
2444,gue bener bener marah benci politik yg menyebabkan virus covid dunia apa memikirkan dampak yg ada dari segala penyekatan ini fasilitas kesehatan sudah sulit tuk membantu sudah melebihi batas,-1,-1,-1
2445,keinget kebijakan muhamadiyah tahun intinya ngerekomendasiin untuk bantu dulu krn lagi kesusahan covid drpd kurban,-1,1,-1
2446,terharu bgt ppkm ternyata bokap bantu org komplek yg sakit ngasih pengobatan gratis sampe nyari obatnya agak susah untuk org yg berhadapan tidak covid dilindungin allah swt,1,1,1
2447,orang keluargaku terkonfirmasi positif covid udh ga nangis ditempat kerja nanganin org covid tp keluarga kena covid ga bs bantu secara langsung sedih yg udh ga diungkapin,-1,-1,-1
2448,berhasil vaksin kedua,1,1,1
2449,bener mengucapkan terima kasih yang udah membantu perjalanan covid dan keluarga tanpamu aku udah kelimpungan,1,1,1
2450,ati twirinde twirinde guhererekanya amafaranga twirinde covid nonese amaherezo aba bantu,1,-1,-1
2451,menuju idhul adha hasil swab antigen antibodi negatif kita nyantai kalau tidak berguna ya ngapain dipake bisa mendeteksi covid spesies bukan mutan kebenaran terkait berita saya nggak tahu,-1,-1,-1
2452,secara sadar pilih saya ambil berhasil mempengaruhi persepsi tingkah terhadap agamanya menjadi baik,1,1,1
2453,nakes relawan covid keren banget udah bukan nyari yang salah benar mending jaga bantu,1,1,1
2454,berjuang samasama ya pencegahan jalan membantu penghidupan rakyat kita upayakan,1,1,1
2455,alhamdulillah vaksin mak tok bakal jadualkan hari esok abah pada minggu terima kasih staff kkm hospital temerloh sukarelawan dewan tun razak membantu urusan mak tadi,1,1,1
2456,menyakiti hati rmy juga bt drngan kata disaat juga berjuang untuk membantu covid,-1,1,-1
2457,wabah covid masuk negeri menyebabkan perekonomian rakyat terseokseok menjelang covid berhut pertama tiba muncul gnwu objeknya bantu jelasin,-1,-1,-1
2458,ternyata fenomena dokterampmasyarakat yg gak percaya covid msh sy usulsiapa tau bs membantu bgmn kl idi mendata dokter yg percaya coviddan masyarakat yg punya mindset yg samabs konsultasi dgn nyamantanpa perdebatan yg tdk perlu tp mhn ttp prokes,1,1,1
2459,seakanakan pemerintah menciptakan covidurusan kesehatan yaurusan pribadi pemerintah membantu menyadarkan agar terhindar menolong penderita itupun bisakalau sakit ya salah sendiritaati prokesjangan salahkan orang sakit,-1,1,-1
2460,efek vaksin ngantuk dah berhasil gue lawan daritadi eh laper tau gitu bener tidur aja dah,-1,-1,-1
2461,btw hari ditawarin bantu kegiatan vaksin rs ui ga spesifik mitna tolong gue sih seandainya ga kuliah gue ga secape mungkin gue udah gas wkwkwk,-1,-1,-1
2462,sore ay bantu temen rsud covid sesak nafas sadarkan langsung inisiatif bantu nakes disana kelihatan lelah semangat nakes relawan ay yg sempet bantu aja td lebkur pasien sudah kualahan malam ay panjatkan doa,-1,1,-1
2463,pelaku umkm kena dampak pandemi covid kita perlu apresiasi selamatkan umkm berhasil bangkit melalui masamasa sulit pandemi covid,-1,-1,1
2464,jadi ngebroadcast jadwal vaksin guru dibalesnya terimakasih bu informasinya membantu terimakasih infonya bun baik bu siap vaksin trims infox,1,1,1
2465,guys tlg bantu amiin yaa spy ayah ku sehat sembuh dr covid,1,1,1
2466,sebentar akan klaim berhasil menurunkan angka penularan covid mengungkap fakta jumlah tes turun diturunkan cukup drastis,-1,-1,-1
2467,orang sarapan makanan sarapan pelajaranv terima kasih corona kamu membuat otakku memikirkan halhal berguna,1,1,1
2468,minta bantu doa yah teman alter kedua org tua ku yg lgi sakit tp gk bsa opnme udah prah padal sekedar minta infus aja ttp gk bsa klo bgini org gk kena covid bsa mati terbunuh,-1,-1,-1
2469,hai gaes gue buka kelas entrepreneurship gratis namanya kelas kepepet kelas pengusaha dibuat khusus untuk membantu yang punya berani buka usaha terpaksa buka usaha terdampak corona,-1,1,1
2470,vaksin membantu membangun perlindungan dalam tubuh disitulah peran dettol untuk membantu perlindungan luar tubuh,1,1,1
2471,asuransi tengah pandemi gni emg sngat berguna yaa biaya utk perawatan covid mahal bet,-1,-1,-1
2472,jadi penting bgt nih menyelamatkan umkm berhasil bangkit melalui masamasa sulit pandemi covid dan wajib mengapresiasi umkm,1,1,1
2473,ribut bahas dinar dirhammantan pejabat pd sibuk nyinyirin medsospandemik covid smakin bertengger diurutan duniawoi bangun dr mimpirakyat dah kelaparan ekonomi smakin nyungsepseyogyanya membantu pemerintahsmoga smuanya cepat usai,-1,1,-1
2474,disaat tokoh masyarakat berlomba membantu anies siapin peti mati biar gak keliatan absurb nya langsung klaim ngasih bantuan oksigen utk pasien covid ternyata juga bantuan ahok,1,-1,1
2475,malam gaes yg tau lokasi vaksin cirebon sekitarnya tolong bantu ya gaes terima kasih,-1,1,1
2476,vaksin gak bikin lu merta kebal virusvaksin membantu tubuhmu mengenali virus yg berpotensi masuk kedalam tubuhmu awal gampangnya si vaksin yg bakal cincay virusnya biar gak ngadi didalem tubuhklo mo masuk masuk ajatp gausa betingkah kira bgitu,-1,-1,-1
2477,hari minggu kemarin depan rumah bapak nawarin jual sepeda rb katanya biaya rs istrinya kami bantu uang ga perlu jual sepeda singkat cerita dahulu koki kena phk covid barusan kontak nanya lowongan kerja,-1,-1,-1
2478,thai tu protes vaksin yg thai berguna pake sinovac ngga si ttp vaksin atau pengen nya vaksin yg bagus ngga vaksin,-1,1,-1
2479,terimakasih untuk satgas covid kecuali camat sudah membantu kelancaran isoman,1,1,1
2480,vaksin kaya udah pede gitu dateng acara lamaran temen kampus udah berpikiran ku penuhi janjiku untuk datang lamaran ku bantu mensukseskan acara realita nge drop dimasukkan virus secara sengaja dan chat sorry gabisa dtg hahaha,-1,-1,1
2481,punya tetangga supportif mau membantu nilai plus kehidupan gue keluarga gue yg positive covid menjalankan isoman disuppobgt warga dikasih waktu berjemur dimaintain hari bersyukur bgt,1,1,1
2482,apa vaksin dah tibabantu ya allah insyaallah moga sinar,1,-1,1
2483,hari saya menguji sistem kesehatan dalam penanggulangan mulai mencari lab mencari rs mencari ambulans memastikan ruangan thanks untuk teman membantu sy orang luar tapi membayangkan orang,1,1,1
2484,dari awal pemerintah salah menilai covid bahkan bansos aja korupsi covid banyak indonesia kehabisan dana bantu rakyatnya lekas pulih indonesiaku,-1,1,-1
2485,anggota dpr ri dprd serentak menyumbangkan gajinya minimal bulan untuk bantu rakyat nakes yg berjibaku garda terdepan melawan covid,1,-1,1
2486,pengin bantu donor darah ga tau udah kontak covid belom,-1,-1,-1
2487,tahun banyak curhat ma kebijakan pusat berbeda ma kebijakan provinsi iyalah kepala daerahnya adu yang berhasil menanggulangi covid pahamlah sampe nyanyi lagu doraemonku sayang doraemonku sih mesin waktu,1,-1,-1
2488,mending ngomong covid tetangga sebelah rumah koarkoar timeline kalo beri bantuan masker mereka lebih aman berguna dibanding marahmarah,1,1,1
2489,udah vaksin kepsek kena kebetulan pas doi blm tau kena ngobrol jaraknya meter yg samping persis beliau kena variannya cepat menular sinovac membantu utk demam tinggi tdk flu berat tdk batuk berat nafas oke anosmia hari,-1,1,-1
2490,punya tetangga yg sadar nga kumpul dan bantu klo tetangga yg positif covid privilege,1,1,1
2491,kpd partai politik sy sarankan utk menjadikan kantor dpc tingkat kabkota utk jd posko vaksinasi lbh baik vaksinnya gotong royong khusus utk kader itu akan lbh berguna terutama partai yg koar nyinyir berguna ayo jadi berguna,1,-1,1
2492,abis vaksin terus setengah jam kali ya belanja mama langsung kena migrain untung udah sampe rumah kali dijalan dah gimana kabarnya harus enakan bantu tumpeng semangat moon,1,1,1
2493,resipien plasma konvalesen usia lakilaki goldar jakarta selatan,1,-1,-1
2494,masalah positif negatif covid tu ujungnya alhamdulillah dikasih negatif alhamdulillah brarti dikasih sehat dikasih positif alhamdulillah plasma darahmu dipake bantu nyelametin nyawa orang dari situ pilih positif negatif,-1,1,-1
2495,kalo saat seluruh rakyat indonesia sdg perang melawan covid bisa menang perang kalo tdk rasa kebersamaan gotong royong bantu bkn masyarakat dituntut prokes,1,-1,1
2496,rakyat jelata yg udah berhasil vaksin covidhow daftar dmn,1,-1,1
