,tweet,bert_predict,lstm_predict,bert_lstm_predict
1169,stre penyebab imun tubuh menurun saja ppkm pemerintah serius membantu masyarakat tidak kena stre akibat kisruh politik ketidak adilan ekonomi ambruk jd penyebab covid tinggi yaity kisruh politik ketidak adilan ekonomi ambruk,-1,-1,-1
1170,baru tau kalo bunga mawar merah nyembuhin corona bisa bantu nguatin imun nambah mood biar seneng terus,1,-1,1
1171,kakakku sekeluarga positif covid skrg isoman dirumah alhamdulillah punya tetangga perawat bisa membantu kakakku isolasi mandiri jaga kesehatan teman jgn sepelekan prokes dan covid minta doanya ya untuk kesembuhan kakakku sekeluarga,1,1,1
1172,ternyata solusi pandemi bukan vaksin kita harus bantu jaga sesama,-1,1,-1
1173,bolihkah menentang covid setakat mematuhi sop berdoa memutuskan rantaian kita anggap doa buat semasa rumah bolih membantu berapa ramai berdoa lebih baik solat jumaat rumah allah benar kita menyuarakan secara padu,1,1,1
1174,sengaja tuhan membantu bapak jokowi untuk mengurangi penduduk indonesia melalu virus covid,-1,-1,1
1175,kemarin mikir gmna cara bantu ningkatin awarene terkait covid hari nyuruh praktikan yg presentasi gua bikin snapgram terkait isu dengan iming nilai presentasi,-1,-1,-1
1176,koarkoarmu konspirasi ga membantu sekali orang yg sakit berguna beramal bantulah yg sakit kayak nakes ga lo udh ga berguna sesat,-1,-1,-1
1177,antigen terakhir kantor membuat panik pak satpam yg sehari bantu valet mobil nerima gofood paket positif covid itu spv yg sehari nya diskusi kerjaan kita positif,-1,-1,-1
1178,emang sengaja dibikin ributbiar penanganan covid ga berhasil isu kekurangan oksigenpengerahan militerberita mencekam rakyat diprovokasi untuk ga percaya pemerintahtapi mendorong lokdon dimana peran pemerintah besar berharap ribut,-1,-1,-1
1179,vaksin berbayar cuih bisnis yg pake alibi membantu percepatan vaksinasi yg gratis aja orang ada yg gamau lagi berbayar,1,1,-1
1180,netizen satusatunya berguna yg bs gue lakuin retweet tweet covid,1,-1,1
1181,gubernur jawa timur khofifah indar parawansa berhrp usaha dpt membantu proses percepatan penanganan kasus covid di bangkalan baiklah,1,1,1
1182,hidup kacau covid datang juga tau pejuang kesehatan berjuang untuk menjaga yg terpapar covid apakah sedikit hati yg dalam untuk pemerintah ppkm rakyat yg susah bantu untuk kelangsungan hidup,-1,-1,-1
1183,lembaga pengelola dana sosial umat baik lembaga zakat nazir wakaf terjun ikut membantu mengatasi masyarakat terkena dampak covid,1,1,1
1184,ga perlu pake borong bear brand vitamin invermectin obat vitamin yg dipakai untuk melawan covid belilah seperlunya krn orang jg memerlukannya harus bersatu melawan covid peduli saling membantu,1,1,1
1185,elemen bangsa bahu membahu diluar bantu narasi positif tidak menjelekan mereka pergi kau covid,1,-1,1
1186,cape mikirin kapan besok aja tentu hidup huhu jelas harapan ini corona cepet ilang berat rasanya liat orangorang yang lebih kurang dariku bantu ya akupun seadanya semoga dilancarkan rezekinya,1,-1,1
1187,indo gini bgt ya pemerintahannya gimana warganya nurut disuruhnya ppkm wfh tp warganya ga dikasih makan ppkm ya gimana org jg gamau matek kelaparan didalem rumah tetangga jg gt kalo yg covid jgn dijauhin bantu beliin makan sm obat gt lho,-1,-1,-1
1188,tanya gaa aksi provokasi bukan kritik kpd pemerintah sudah dilakukkan bbrp tikus tangkap rijal ram garong lain yg sejenis pak polisi bantu rakyat corona aja gaa sibuk fitnah doang,-1,-1,-1
1189,virus yg lbh bahaya dri covid virus yg berbentuk hati krna suntikan apapun tdk berguna,-1,-1,-1
1190,ada orang meninggal aja bgt yg gak bantu takut covid al hasil keluarga apa,-1,-1,-1
1191,mentemen minta bantu doa untuk kesembuhan bapak mertua icu akan pasang ventilator semoga keadaan bapak cepat membaik aamiin ini semua covid lho temanteman jadi tetap jaga kesehatan terapkan prokes ya,1,1,1
1192,btw pabriknya predator beberapa yg positif pas kerja kemaren doi gantiin kerjaan temenya tumbang terus kemaren malem ga masuk garagara demam malam mau swab bantu doanya semoga corona kalopun doain survive ya,1,1,1
1193,sebenernya vaksin nusantara buatan dokter anak bangsalebih bagusya lagi negara dipenuhi mafia dkkagak susah maju kalo punya inovasidrterawan berhasil menyembuhkan stroke cepatmetodenya lagi diadopsi jerman,1,-1,1
1194,negara yg berhasil kendalikan covid kan ya ga ambil pelajaran siapa bang ya kita pemimpinnya rakyatnya aparat keamanannya pengusahanya tokoh agamanya,-1,-1,-1
1195,berhasil geret papah puskesmas vaksin,-1,-1,-1
1196,larangan mudik tdk berhasil larangan wisata tdk berhasil penularan covid banyak pas angka covid melonjak pas jadwal anak sd ujian akhir naik kelas tatap muka heran kemaren nyoblosnya udah bener belum sih,-1,-1,-1
1197,selamat malam mohon ijin share kerabat kakak ibu teman terkena covid berkenan mohon bantuannya yang membantu menginfokan bersedia melakukan donor plasma konvalesen untuk golongan darah ab cp diaz agung,-1,1,1
1198,akhrnya bokap nyokap berhasil dpt jdwl vaksin dosis pertama cartaw sanasini baru gini aja leganya semoga php yah,-1,1,-1
1199,resipien plasma konvalesen usia perempuan goldar palembang sumatera selatan,1,-1,1
1200,india memasuki fase terparah covid diseluruh dunia semoga negara yg covid sdh mereda membantu india rasa kemanusiaan ayo dunia bantu india,-1,1,1
1201,nanya dok dok dokter orang yg membantu seorang lansia lewat bln divaksin yg kedua utk covid harus mengulang vaksin pertama tidak terima kasih,-1,1,-1
1202,menteri kena covid gak bilang katanya untuk bangun optimisme publik wabah dilawan kayak korupsi terus gak ditangkep beri kesan negara berhasil memberantas korupsi terus ketahuan ambruk bkn optimisme pak kepercayaan gagal,-1,-1,-1
1203,resipien plasma konvalesen usia perempuan goldar bekasi,-1,-1,1
1204,pernah yg blg dgn seyakin nya kl covid berakhir juni trus blg lg awal thn dia yg bs bantu jawab,-1,-1,1
1205,gembargembor membantu percepatan vaksin pelaksanaan nang lapangan zonk,1,1,-1
1206,pemerintah gencarkan vaksinasi pkk membantu bagikan masker gratis masyarakat,1,1,1
1207,suka banget nemu akun tiktok awam bantu membenarkan hoax salah ttg covid salah satunya medic kadang gada waktu cari hoax aneh bantu edukasi benerin benerin attitude pola pikir pentingnya tugas frontliner,1,-1,1
1208,lupa tgl harus bantu vaksin,-1,1,-1
1209,kita lakukan menghadapi covid patuh protkes yang di anjurkan pemerintah termasuk upaya selamatkan sendiri keluarga lingkungan secara langsung sudah membantu pemerintah menanggulangi meluasnya virus,-1,-1,-1
1210,menteri timbalan menteri mengambil gaji bulan gaji akan disumbangkan tabung amanah bencana untuk membantu mangsa covid,1,1,1
1211,timbang ngurusi ra percoyo covid tur mencak ng twiter coba mending bergerak km bantu kasih makan org yg ba bs kerja km beli dagangan temen km biar ekonominya muter sambat tok ra obah blok,-1,1,-1
1212,kasus covid terus naik jumlah korban yg meninggal jg banyak rs dmna udah penuh berita duka dimana masih yg ga percaya covid duh mending yg gpercaya covid nih jd relawan covid aja gmn biar berguna jg negara,1,-1,-1
1213,nanya serius neh tolong bantu jawab ya perlunya vaksin covid kalian trus efek nya byk positif negatif jujur klo liat berita serem ya yg katanya habis vaksin demam sampai juga yg meninggal,-1,-1,-1
1214,sekolah ngadain vaksin hari minggu belom pemberitahuan lanjut tp kyknya senin sekolah seharusnya pasca vaksin istirahat semoga seninnya nggak berat matpel pertama aja kimia,-1,-1,-1
1215,perbanyak happy makan makanan bergizi ttp olahraga ttp healthy puji tuhanberhasil melewati menjadi pejuang covid,1,1,1
1216,pak bantuan bencana covid kalo ga bantu se enaknya perintah ancurin dagangan dong,-1,-1,-1
1217,jujur pengen covid biar bantu donor plasma convalescent pengen kenanya doang nularin ga yakin survive sih kalo kena ah taulah,-1,-1,-1
1218,yang habis kena covid donor plasma darah nya ya itungitung membantu orang tua diluar yang berjuang sembuh,-1,-1,1
1219,jaga sendiri saudara keluarga perketat prokes gelombang covid datang besar ayo dulur orang gapercaya covid diladenin karena nggak ada gunanya pakai masker double membantu,-1,1,-1
1220,semenjak covid trs hrs pke masker setting spray jd berguna pdhl sblmnya nganggur dipajang doang,-1,-1,-1
1221,halodoc bagus membantu pengadaan vaksin covid drive thru untuk lansia nganterin ibuku vaksin jadinya cepat banget nggak antrinya nggak satu jam selesai lokasinya nggak jauh rumah alhamdulillah,1,1,1
1222,ada aja cobaan hidup bernama komentar sruntalsruntul tiada berguna para prajurit nda percaya covid ibu kota,-1,-1,-1
1223,berhempas pulas frontliner membantu pesakit positive covid terutamanya pesakit memerlukan khidmat pembantuan pernafasan di icu,1,1,1
1224,alhamdulillah hari bantu orang vaksin,1,-1,1
1225,halo keluarga sinar mas pandemi covid masih terjadi saat telah mengajarkan untuk bergotong royong membantu untuk melewati masa sulit bersama,1,-1,1
1226,akhirnya mmg hrs berdamai berdampingan dgn nantinya seperti penyakit flu yg penting jaga imun iman meskipun vaksinasi berhasil seluruh warga iman imun sgt perlu utk melawan jenis virus,-1,-1,1
1227,hambalang spocenter berhasil dibangun kesulitan menyediakan ruang untuk pasien covid berkurang sayang ngg jadi kasus korupsi mubajir,-1,-1,-1
1228,situasi pandemi covid india memburuk orang meninggal jamnya pihak militer dikerahkan untuk membantu penanganan covid india,-1,1,-1
1229,kemaren tuh gatel banget pengen komen soal sistem vaksinasi covid njlimet masyaallah bikin pengen koprol gunanya sih ektp sampe vaksin aja pendataannya ribet banget kakek nenek disuruh ngisi gformokelah yang ga gaptek yg punya anak cucu bantu,-1,-1,-1
1230,guna nya test swab antigen dibandara hanya tuk mencari duit aja kenapa kebanyakan negatif berhasil berangkat keluar kota hanya memeras rakyat pemeriksaan covid,-1,-1,-1
1231,quotes hari covid berhasil mendekontruksi tatanan teriakan revolusi,1,-1,1
1232,bem ui ugm mengkritik presiden bagustapi kondisi pandemi covid manusia bermanfaatlah membantu pahlawan kemanusian tenaga kesehatan bekerja mati matian bem ui ugm manfaatnya pandemi covid mendunia perekonimiannya hancur akibat pandemi,1,1,-1
1233,kangmas salah satu poin masuk investor indonesia krn kangmas berhasil menjaga stabilitas politik nasional baik legislative menangani koalisi parpol hari klb demokrat yg dipaksakan membuat keraguan investor saat sdg covid,1,-1,1
1234,berhasil memberikan vaksin copit raffi ahmadapasih prestasinya awakwowowo,1,1,1
1235,tahap ketiga pemberlakuan ppkm mikro jatim menurut bu khofifah berhasil penurunan kasus covid,-1,1,1
1236,musim covid gini pkoknya hidup aja dlu berguna gak nya urusan belakangan,-1,-1,1
1237,dilema hidup rakyat di tengah pandemi ekonomi sulit hantu kematian dilema vaksin invermectin wedang jahe degan ijo bantu tetap yakin semangat kehidupan memiliki hukumnya dan dunia terus bergerak,1,1,1
1238,satpol pp apa sebelum covid kerjaan pol pp gitu aja ga berguna eh skrg mentang giliran covid malah seneng kerjaan sok sibuk diratain kelakuannya yg biadab mangkannya smua sok keras udah nglebihin polisi lagaknya,-1,-1,-1
1239,terima kasih untuk corona berhasil menghasilkan miliuner triliuner baru pembicara handal mengurangi populasi manusia,1,1,1
1240,punya mutual yg dokter perawat trus apoteker disaat ini membantu bgt baik bgt jawabin kalo tanya soal kesehatan covid,1,1,1
1241,sy lihat partai anggota dewan turun kewarga bantu pemerintah rakyat penanganan covid yg menggila mereka hadir cuman dimusim kampanye,1,-1,-1
1242,tindakan ini membantu lingkungan loh selama pandemi covid sekali dampak lingkungan dikarenakan perubahan pola hidup,1,1,1
1243,positif covid sadar rebahan malesmalesan kamar berguna menghadapi pandemik,-1,-1,-1
1244,terimakasih pak tindakan cepat bapak menyikapi kelangkaan oksigen ruang perawatan penderita covid membantu situasi chaos ini,1,1,1
1245,virus covid ajar manusia bahawa kebanyakkan masa parti politik jentera kempen adalah berguna,-1,-1,1
1246,orang merasa diapusi covid melihat negara perlahan mulai kembali beraktivitas normal ga peduli dgn yg dilakukan akhirnya berhasil tahap tsb kebijakan pemerintah yg jelas masyarakat yg taat ampmau divaksin kitamasih denial ampanti vaksin,1,-1,1
1247,gubernur jawa timur mengatakan dlm kurun waktu kurang dri tiga buln jawa timur berhasil menekan laju penyebaran covid keluar dri zona merah kurva penambahan kasus baru jawa timur ruz melandai,-1,-1,1
1248,corona menumbangkan sendi sendi kehidupan masyarakat sekaranglah moment manusia membantu manusia mari buktikan manusia beradab ketimuran melihat sekeliling kita yg butuh makan vitamin suplemen hidup,1,-1,1
1249,akhir sering overthinking gegara kasus covid naik bgt indo satu persatu temen positif cuman bantu doa mereka,-1,-1,-1
1250,barusan bantu tetangga daftar vaksinasi puskesmas kata nakes disana sdh gk sbb ketersediaan vaksin sdh habis bulanan baru lagi lat ramai yg ngantri utk divaksin kata nakesnya khusus utk vaksinasi yg tempat ada tp jauh sabar ya,-1,-1,-1
1251,kalo udah berhasil regist akun daftar pedulilindungi habis gimana ya soalnya tertulisnya faskes covid artinya langsung dateng aja gmna,-1,-1,-1
1252,yg pro kontra soal vaksin berbayar yg pro kontra ga minimal tergerak ga utk ngebantu bayarin biaya rs krn kena covid iya bantu gw misalnya biaya covid utk orang mahal gw ga peduli soal vaksin bayar ngga otak gw udah cupet mikir tagihan rs,-1,-1,-1
1253,mereka tidak percaya covid ada membantu pemakaman tpu rorotan ke ugd rumah sakit apd lengkap,-1,1,-1
1254,gw ngga bantu apaapa adekadek gw covid gw gagal jadi kakak apa gw sekolah kedokteran mereka ngga gw jaga gw ngga guna gw malu gw yg nya bikin mereka sehat gw skrg ngga apaapa udah,-1,-1,-1
1255,nih anggota dewan katanya wakil rakyat rakyat susah yo mbok dibantu sudah bantu jadi anggota dewan susah gegara covid,-1,-1,-1
1256,ambulans kami kirim pihak rsud dr soetomo untuk membantu pelayanan pasien utamanya pasien covid kata alwi,1,1,1
1257,hari banyak korban covid yg wafatsampai pandemi berakhir ayok bantu pemerintah terapkan prokes ketat utk mengurangi laju covid yg menggila,-1,1,-1
1258,temenku ngajak bikin tagar yg isinya bangga jadi lulusan corona asalnya garagara cemoohan senior menurutku yg berhasil lulus pandemi bertanggung jawab mampu beradaptasi,1,1,1
1259,terus prioritaskan percepatan vaksinasi utk pencapaian target herd imunity bisa hidup berdampingan covid pada commen ga jelas baik pastikan keluarga sdh divaksin mari bantu nakes polri tni dan pemerintah utk percepatan,1,-1,1
1260,pengalaman vaksinasi covid dos pertama insyaallah berguna masa korang adalah bebenang,1,1,1
1261,isoman alhamdulillah membaik perang covid ternyata allah sayang padaku saat genting kasus corona naik drastis di wajibkan isoman membantu buat gak kemana cukup dirumah walaupun isoman gak kerja dan gak digaji,1,1,1
1262,lagi isolasi mandiri istri berdoa semoga berdua cepet sembuh nantinya plasma darah bisa berguna para penyintas covid yg membutuhkan donor plasma darah aamiin covid nyata gaes meremehkan,1,1,1
1263,anak anak bantu daftarkan vaksin utk parent masingmasing,1,-1,1
1264,kaget banget perak aja bisa bantu untuk pembiayaan covid yuk lagi bisa bantu jaga perak,1,-1,1
1265,gubernur khofifah mengimbau kepda aparatur sipil negara asn kabupaten kota untuk membantu percepatan penyelenggaraan vaksinasi,1,1,1
1266,fokus bantu yg terpapar covidpadahal jauh banyak manusia yg menderita adanya covid yg perlu bantu,-1,-1,-1
1267,denger berita sedih kemarin denger kabar tetangga meninggal gegara kekurangan oksigen sakitnya covid tp butuh oksigen untuk alat bantu nafas aduh ga kebayang sumpah kondisinyaa gimana,-1,-1,-1
1268,mohon bantuan mimin nama pasien dedy syarifudin pasien rs pusat pertamina dibutuhkan urgent donor plasma konvalesen golongan darah untuk pasien covid handai taulan yg bersedia membantu menghubungi dyah nomor terima kasih min,-1,1,1
1269,semoga ada kluster baru indonesia india dijadikan contoh negara yg lengah cepat puas berhasil menahan laju penyebaran covid itu lihat covid datang bak tsunami meluluh lantakkan warganya kasus perhari innalillahi,-1,1,-1
1270,sih vaksin bayar orang kaya ayo katanya kaya masa nebeng yg gratis bantu negara dong nyinyir wae,-1,1,-1
1271,resipien plasma konvalesen usia perempuan goldar ab cikupa,-1,-1,-1
1272,hari tangg juni memutuskan divaksin alasannya karena negara yg bikin ribet berhasil ga pasrah jenis vaksin yg disuntikan saya tidak peduli,-1,-1,-1
1273,yukkawan teman sahabat keluarga yg berlebihan duityukikut vaksin mandiri yukanggota kadin anggota hipmi karyawan pekerja ikut vaksin mandiri biar mencapai herd immunity biar bantu agar ppkm darurat tdk diperpanjang,-1,-1,-1
1274,selamat malam pak kemenkes berusaha untuk mendapatkan vaksin curevac vaksin mrna terbaru dapat disimpan suhu derajat bulan akan berguna terima kasih,1,1,1
1275,perasaan sudah vaksin sebulan lalu pas swab kok positif yang bantu menjelaskan,-1,-1,-1
1276,pak tolong pak bantu mendapatkan vaksin dosis scr dosis sudah dapatkan stasiun wargamu ktp sukoharjo selalu ditolak untuk mendapatkan vaksin dosis,-1,1,-1
1277,ngajak masyarakat untuk nyumbang vitamin nakes mayoritas masyarakat banyak sengsara akibat covid mending pejabat tuh kasih tau anaknya yang suka foya foya untuk stop kebiasaan buruk karena uangnya mending dipake bantu,-1,1,-1
1278,semangat ya kawan bantu orangtua sampai vaksinasi,1,1,1
1279,penyintas covid golongan darah ngga butuh donor buatan konvaselen soalnya ibu nya temen ku butuh donor kebetulan sekeluarga udah drop tolong bantu ya tementemen,-1,1,-1
1280,gomen naikkan cabutan judi kali lebai diam bisu gomen bg kebenaran kredit komuniti beroperasi bnga smpai lebai jd pekak vaksinasi lmbat mcm siput lebai bt nampak rakyat kempen bendera putih bantu derita rakyat mulut lebai tiba berbuih mcm sawan babi,-1,-1,-1
1281,darurat membantu untuk mencegah covid cegah celah,-1,1,1
1282,hindari corona tetap hidup tidak berguna keep smile,-1,-1,1
1283,isolasi mandiri bantu cegah penularan covid bantu cegah penularan orang ngeyel stupid gak ya eh engga deh kayanya ya,-1,-1,-1
1284,iri melihat negara berhasil tangani covid hasil kolaborasi masyarakat pemerintahnya disini sibuk ppkm darurat hanya nama ditambah jerinx yang bikin huruhara,-1,-1,-1
1285,vaksin berguna ini,-1,-1,1
1286,pemprov jatim libatkan peran pesantren bantu penanganan covid bangkalan,1,-1,1
1287,untuk pemula dunia usaha dimasa covid berat ketika dihadapkan dg setumpuk perizinan usaha yg berbelit mahalandai kata perizinan usaha dipermudah sudah membantu berkutat dg perizinan donk memulainya,1,-1,-1
1288,yg berhasil memfasilitasi vaksinasi kpd dari ribu jelas terobosan yg oke semoga terus berkontribusi utk penanganan pandemi yg blm kunjung usai saat ini,1,1,1
1289,dibutuhkan donor darah temen udah sembuh covid kurang bulan bersedia untuk bantu mendonorkan darahnya dm atau whatsapp nomor bantuan temen berarti aku,1,-1,1
1290,mentri india yg mundur malu dianggap gagal tangani covid di udah gagal ngakunya berhasil gak malu boro mundur malu aja kagak punya,-1,-1,-1
1291,ak punya nazar bagi nasi bungkus orang dijalan kalo adek ak sembuh dr covid februari kemaren belum kesampean karna keburu putus mas mantan gaada yg bantu ak bagiin karna ak gapunya kendaraan kek ya,-1,-1,-1
1292,semoga aja corona tahun dah ilang idup serasa gak berguna closet,-1,1,-1
1293,hari merasa tdk berguna badan lemes abis vaksin,-1,-1,-1
1294,pergi belanda ingin pulang indonesia bulan lulus takut balik indonesia covid gak tau bantu dan gak tau kerja cari negara,-1,-1,-1
1295,vaksin gratis kesempatan para rakuat jelata untuk membuktikan rakyat jelata bisa membantu negara melawan pandemi,1,1,1
1296,vaksin bantu herd immunity ngikutin anjuran pemerintah biar jadi agen rahasia,-1,-1,-1
1297,susahnya nyuruh orang jakarta jgn mudik adlh orang jkt kebanyakan perantau jd tetanggaku mayoritas perantau mrk sakit pasti pulkam krn mrk gak punya supposistem sini tetangga udah bantu tp terbatas krn nasibnya makanya covid jalan kampung,-1,-1,-1
1298,hari dapet kabar duka nenek jauh meninggal covid keluarga dirumah gabisa ngapa ngapain kecuali nanya kabar bantu urus urus via tlp,-1,-1,1
1299,posko penanganan covid evaluasi berkala bisa memberikan masukan cepat pencegahannya skala mikro sama aja penerapan ppkm jawabali tdk berhasil turunkan kurva,-1,1,1
1300,jujur sini bingung penanganan covid negeri kasus kian hari kian melunjak korban meninggal disangka banyaknya yang terpapar berhasil menyesaki rumah sakit setiap tempat,-1,1,-1
1301,pertanyaan serius guyysnegara mna besar terpapar covid dn negara mna sja yg krn persoalan covid smpai rakyatx penjara dgn vonis thn tlg bantu jawab guyys,-1,-1,-1
1302,ngeliat pasien yg harinya berjuang melawan covid yg diderita alat bantu nafas berbanding terbalik orangorang berkeliaran masker,-1,-1,-1
1303,ucapan satgi mesti summary pernah spjang covid billion dah keluarkan utk bantu bla bla bla ceh,-1,-1,-1
1304,ada peningkatan kasus ekstrim sepekan alangkah baiknya opsi lockdown jadi pertimbangan belajar negara tetangga banyak berhasil mengendalikan covid cara lockdown kayanya mustahil ya indonesia lockdown,-1,-1,-1
1305,ada duit utk bantu rakyat klau lockdown ptg gaji menteri setakat meeting utk perketat sop covid mengganas lepas pukul apa,-1,-1,1
1306,disuruh gotong royong tuh vaksinnya masyarakatnya disuruh gotong royong membantu satu lain oh iya yg bantu vaksin org mah ngurusin masing saling membantu satu lain keharusan,1,1,1
1307,yg bikin stre covid sudah jelas yg gejala berat perlu dirawat rumah sakit sekalinya udah masuk ruangan perawatan keluarga kerabat gak melakukan hal bantu kirim doa,-1,-1,-1
1308,yg nik nya udh terdaftar pedulilindungi tp blm vaksin belum dpt nomor tiket vaksin cara nya gmn ya mau vaksin tp nik ku udh terdaftar pdhl belum vaksin gabisa daftar lagii tt bantu ya ii banyyak oiya cont,-1,-1,-1
1309,orang tolol tidak percaya corona membantu mempercepat seleksi alam,-1,1,-1
1310,katanya skrg salah satu yg bantu naikin saturasi oksigen dlm darah pasien covid adalah plasma pasien covid berhasil sembuh iya,1,1,1
1311,percayalah negara corona dijadikan alat untuk pemain mencari keuntungan kapan hanya diam dan terus hidup ini vaksin yg berguna pakai masker tidak fungsinya,-1,-1,-1
1312,corona vaksin saya hanya berbagi pengalaman vaksin berhasil memberi perlindungan saya terinfeksi virus corona membuat gejala saya derita menjadi berat,-1,-1,-1
1313,cm menempatkan masalah sesuai porsinya lapangan masyarakat proses vaksinasi kompleks ga hitam putih kek di twitter ga kritik sangat tpi gebyah uyah niat membantu harus dinyinyiri,-1,-1,-1
1314,temen kantor atasan ibu yg kenal sejak sebesar yg memanjakan beliau tetap single sekarang yg wataknya keras berhasil bantu ibu kantor sampai ibu handle itu meninggal semalam karena covid,-1,1,1
1315,lah pakar ekonomi lah pakar agama lah pakar covid dia apa satu jari dia tak angkat utk bantu dia pung pang pung pang tahun sampai skg,-1,-1,-1
1316,palestian di bantu puluhan milyar yu akh sama bersatu membantu untuk indonesia meringankan covid pemerintah kewalahan adi hidayataa gymuym,1,1,-1
1317,denger dgn kuping ad org yg notabene nakes nakes lhosekali lgi nakes dgn bngga ny blng berhasil berdebat kekeuh utk vaksin lha kalo nakes aja yg notabene phm soal kesehatn kya gini gmna yg awam soal kesehatan angel wes angel,-1,1,-1
1318,gedung dpr kosongin aja jadi tempat vaksin permanen biar ga pindah sekalisekali berguna,-1,-1,-1
1319,berhasil daftar untuk vaksin dapet nomer antrian,-1,1,1
1320,moots orang udah shaf anggep kakek sndiri udh ninggalin dunia kmaren karna kena covid bantu doa smoga amal ibadah nya terima allah dilapangkan kuburnya makasih sbelumnya,1,1,1
1321,ayahku postif covid sampe isoman rs pake alat bantu pernapasan karna ngeluh dadanya sesak bawaannya hari nangis bawang lagi gencarnya ppkm tante mami ku positif usia rentan kaya gitu bikin jadi tambah parnoan,-1,1,-1
1322,ga ke medan pdhl minggu mo ngawinkan anabul lajang mo vaksin bayi anabul ga kesel sm covid ku kesel sm rangorang yg gabisa bantu mencegah penyebaran krn sepele sm keadaan maunya covid hilang tp pake masker engga,-1,-1,-1
1323,pemerintah pusat lakukan vaksinasi gotong royong perusahaan swasta alternatif yg membantu vaksinasi indonesia india meng embargo vaksin astrazeneka masuk indonesia,1,1,1
1324,saya survive jadi kakek sy bercerita cucu zaman kakek muda ada wabah namanya covid itu pahlawan yang bantu org kesusahan ada org bebal yg menyulitkan org dg nyebarin opini covid rekayasa,-1,1,-1
1325,punya saudara gk beda tetangga julid wkwkwk gitu orang kesusahan udh lewat positif covid udh karantina hari udh negatif adeknya mintain bantu anterin beli kebutuhan rumah tangga aja eh pulang di makimaki adeknya lol,-1,-1,-1
1326,sertifikat vaksin barcode nya ngecek keaslian yaa lu jauh kemana sih pake scan scan barcode gitu surat strp yg ada barcode nya kagak berguna tuh msama halte transjak,-1,-1,-1
1327,absen pagi berhasil pulang perawatan ibu tinggal menanti kepulangan suami anak cowo covid sungguh mencerai beraikan isi rumah semoga pandemi usai,1,1,1
1328,bansos aja korupsi ratusan trilyun istilah baru lepas tangan gak ada solusi untuk membantu bgmn rakyat makan dipaksakan dgn vaksin yg jelas byk efek sakit meninggal dunia yg tak tanggung jawab kasihan rakyat negeri,-1,-1,-1
1329,diceritain kalo bapak rumah ikut bantu makamin tetangga deket yg meninggal covid pake apd lengkap sesungguhnya juga punya daya upaya menghalangi bismillah semoga diberikan perlindungan,1,1,1
1330,abamotari nibo bantu badashobora kwibagirwa igihe covid yagereye mu rwanda,-1,-1,-1
1331,ayo vaksin biar bisa bantu,1,1,1
1332,vaksin anak akan menghindari penyakit anak dewasa membantu melindungi generasi selanjutnya melindungi orang,1,1,1
1333,udh vaksin pertama bulan tp dipedulilindungi blm tercatat ya udh vaksin ga sertifikat yg bantu dicarikan solusikahh thanks,-1,-1,-1
